title,link
A Mysterious Cézanne Portrait Was Hiding Under the Layers of a Still Life,https://www.atlasobscura.com/articles/cezanne-hidden-portrait
Turrican 2 AGA,https://sonicslothgames.itch.io/turrican2aga
The Flox Open Beta,https://floxdev.com/blog/flox-open-beta
Database of VC investment announcements,https://www.vcinsights.co/
Monocle: A pocket sized open-source AR device,https://www.brilliantmonocle.com/
"Show HN: SQRL – Anti-spam rules language Twitter acquired in 2018, open-sourced",https://websqrl.vercel.app/twitter
Big data is dead,https://motherduck.com/blog/big-data-is-dead/
Microsoft announces new Bing and Edge browser powered by upgraded ChatGPT AI,https://www.theverge.com/2023/2/7/23587454/microsoft-bing-edge-chatgpt-ai
Meta to ask many managers to become individual contributors or leave,https://www.bloomberg.com/news/articles/2023-02-07/meta-to-ask-many-managers-to-become-individual-contributors-or-leave
Jerry (YC S17) Is Hiring Sr / Staff Software Engineer (中国远程）,https://jobs.ashbyhq.com/Jerry/142d1a0a-56e4-4deb-92bd-20c0e13d35f9
Google's Bard shows incorrect information in its launch ad,https://twitter.com/IsabelNAngelo/status/1623013720011194368
Show HN: Docker rollout – Zero Downtime Deployment for Docker-compose,https://github.com/Wowu/docker-rollout
The unknown language and letters of Hildegard von Bingen (2015),https://sites.nd.edu/manuscript-studies/2015/10/01/letter-i-ardly-know-er-the-unknown-language-and-letters-of-hildegard-von-bingen/
Google Project Sunroof,https://sunroof.withgoogle.com/
Google and Mozilla are working on iOS browsers that aren't based on WebKit,https://arstechnica.com/gadgets/2023/02/google-and-mozilla-are-working-on-ios-browsers-that-break-current-app-store-rules/
Lisa Source Code: Understanding Clascal,http://eschatologist.net/blog/?p=314
Zoom lays of 15% of employees,https://blog.zoom.us/a-message-from-eric-yuan-ceo-of-zoom/
An Introduction to Class Warfare for the Software Engineer,https://medium.com/@lloyd-f-hough/an-introduction-to-class-warfare-for-the-software-engineer-1810833055d7
David Sabatini lands millions from private donors to start new lab,https://www.science.org/content/article/sabatini-biologist-fired-sexual-misconduct-lands-millions-private-donors-start-new-lab
The Black Ships Shock: A Historic Encounter That Changed Japan,https://www.nippon.com/en/japan-topics/g02197/
Why do we create modern desktop GUI apps using HTML/CSS/JavaScript? (2022),https://gerrysweeney.com/why-do-write-desktop-gui-desktop-apps-in-html-css-javascript-making-them-just-glorified-web-pages/
Google and Mozilla are working on iOS browsers that aren't based on WebKit,https://www.theregister.com/2023/02/07/mozilla_google_apple_webkit/
First Builder’s Remedy Plan for Bay Area Revealed in Los Altos Hills,https://sfyimby.com/2023/02/yimby-exclusive-first-builders-remedy-plan-for-bay-area-revealed-in-los-altos-hills.html
The Design of Postgres (1986) [pdf],https://dsf.berkeley.edu/papers/ERL-M85-95.pdf
Bill would ban the teaching of scientific theories in Montana schools,https://www.mtpr.org/montana-news/2023-02-07/bill-would-ban-the-teaching-of-scientific-theories-in-montana-schools
Nintendo Will Pay Its Workers 10% More,https://www.gamespot.com/articles/nintendo-will-pay-its-workers-10-more/1100-6511268/
The Quest to Find Rectangles in a Square,https://www.nytimes.com/2023/02/07/science/puzzles-rectangles-mathematics.html
Nullness markers to enable flattening,https://mail.openjdk.org/pipermail/valhalla-spec-experts/2023-February/002223.html
"Dino 0.4 – Message Reactions, Replies and GTK4",https://dino.im/blog/2023/02/dino-0.4-release/
Jerry (YC S17) Is Hiring Sr / Staff Software Engineer,https://jobs.ashbyhq.com/Jerry/142d1a0a-56e4-4deb-92bd-20c0e13d35f9
Steps towards prompt-based creation of virtual worlds,https://arxiv.org/abs/2211.05875
The Busy Beaver Challenge,https://bbchallenge.org/
Project Sunroof,https://sunroof.withgoogle.com/
"The 28,000 year old cave paintings in Cosquer Cave (Underwater)",https://www.bradshawfoundation.com/cosquer/
Blender moves from Phabricator to Gitea,https://code.blender.org/2023/02/new-blender-development-infrastructure/
Play Runescape Classic Again,https://rsc.vet/
Discovery of an Exceptionally Rare Nearby and Energetic Gamma-Ray Burst,https://arxiv.org/abs/2302.03642
Intelligence is everywhere: From AI to cephalopods,https://newhumanist.org.uk/articles/6068/intelligence-is-everywhere
CBMC: The C Bounded Model Checker,https://arxiv.org/abs/2302.02384
Prehistoric Images and Medicines Under the Sea in Cosquer Cave,https://www.bradshawfoundation.com/cosquer/
Ask HN: How to know if laptop enrolled in Intel Management Engine?,https://news.ycombinator.com/item?id=34702825
Reality Check,https://www.vulture.com/article/tv-documentaries-ethical-standards.html
It was the biggest painting in the world – how could it just disappear?,https://forward.com/culture/534139/symeon-shimin-movie-largest-painting-gina-lollobrigida-yul-brynner/
The New Madrid Seismic Zone,https://www.usgs.gov/programs/earthquake-hazards/new-madrid-seismic-zone
An In-Depth Look at WebGPU,https://unzip.dev/0x00f-webgpu/
Open RuneScape Classic,https://rsc.vet/
PocketPy: Lightweight(~5000 LOC) Python interpreter for game engines,https://github.com/blueloveTH/pocketpy
‘Confirming we are cleared to land?’ Who said what at Austin,https://fallows.substack.com/p/as-bad-as-it-gets-without-body-bags
Use GPT-3 incorrectly: reduce costs 40x and increase speed by 5x,https://www.buildt.ai/blog/incorrectusage
Show HN: We built an open-source LaunchDarkly alternative for B2Bs,https://www.enrolla.io
Fundamental Math for Game Developers,https://pikuma.com/blog/math-for-game-developers
The Broom Method,https://shop.minimuseum.com/blogs/cool-things/the-broom-method
FlexiRaft: Flexible Quorums with Raft [pdf],https://www.cidrdb.org/cidr2023/papers/p83-yadav.pdf
A lightweight (~5000 LOC) Python interpreter for game engines,https://github.com/blueloveTH/pocketpy
Zoom lays off 15% of employees,https://blog.zoom.us/a-message-from-eric-yuan-ceo-of-zoom/
Transmission v4.0,https://github.com/transmission/transmission/releases/tag/4.0.0
Browsers are essential and how operating systems are holding them back (2022) [pdf],https://research.mozilla.org/files/2022/10/Mozilla-Five-Walled-Gardens.pdf
What is a CDN? How do CDNs work?,https://animeshgaitonde.medium.com/content-delivery-network-cnd-explained-in-simple-words-674e971b06c3
The Artist Who Collaborates with Ants,https://www.newyorker.com/culture/persons-of-interest/the-artist-who-collaborates-with-ants
"Posix Compatibility Comparison: GCP Filestore, Amazon EFS, and Azure Files",https://juicefs.com/en/blog/engineering/posix-compatibility-comparison-among-four-file-system-on-the-cloud
The history of “typeof null” (2013),https://2ality.com/2013/10/typeof-null.html
"Incident: Qatar B788 at Doha on Jan 10th 2023, steep descent after takeoff",https://avherald.com/h?article=504d75c7
Historical Timeline of the Akai MPC,https://www.millennialmind.co/the-historical-timeline-of-the-akai-mpc/
Show HN: Kuboble.com – minimalistic sliding pieces puzzle game,https://kuboble.com
Estonian Foreign Intelligence Service's 2023 Security Report,https://raport.valisluureamet.ee/2023/en/
Can sanitizers find the two bugs I wrote in C++?,https://ahelwer.ca/post/2023-02-07-cpp-bugs-sanitized/
"Open source cloud file system. Posix, HDFS and S3 compatible",https://juicefs.com/en/
Reverse engineer Stable Diffusion images,https://www.img2prompt.io/
Value-Oriented Programming,https://accu.org/journals/overload/31/173/teodorescu/
Knuth-Plass Thoughts,https://github.com/jaroslov/knuth-plass-thoughts/blob/master/plass.md
Ask HN: HN for Finance?,https://news.ycombinator.com/item?id=34706550
Browsers are essential and how operating systems are holding them back (2022) [pdf] (2022),https://research.mozilla.org/files/2022/10/Mozilla-Five-Walled-Gardens.pdf
Ask HN: Best practices for self-healing apps?,https://news.ycombinator.com/item?id=34706624
What 2023 will bring for PeerTube,https://joinpeertube.org/news/roadmap-v6
Show HN: Kuboble.com – Minimalistic sliding pieces puzzle game,https://kuboble.com
Meilisearch 1.0 – Open-source search engine built in Rust,https://blog.meilisearch.com/v1-enterprise-ready-stable/
Turkey blocks Twitter after the earthquake,https://netblocks.org/reports/twitter-restricted-in-turkey-in-aftermath-of-earthquake-oy9LJ9B3
Transparent Telemetry for Open-Source Projects,https://research.swtch.com/telemetry-intro
Toxic Exposure: The True Story Behind the Monsanto Trials,https://www.press.jhu.edu/books/title/12717/toxic-exposure
The digital pound: A new form of money for households and businesses?,https://www.bankofengland.co.uk/paper/2023/the-digital-pound-consultation-paper
Linux 6.1 Officially Promoted to Being an LTS Kernel,https://www.phoronix.com/news/Linux-6.1-LTS-Official
Google's Live from Paris Event Private/Deleted Immediately,https://news.ycombinator.com/item?id=34708255
Img2Prompt – Get prompts from stable diffusion generated images,https://www.img2prompt.io/
Heat pumps are defying Maine’s winters and oil industry pushback,https://www.washingtonpost.com/climate-environment/2023/02/07/maine-gas-industry-heat-pumps/
George Orwell's 6 rules for writing (2018),https://infusion.media/blog/george-orwells-six-rules-for-writing/
Ask HN: I just want to have fun programming again,https://news.ycombinator.com/item?id=34706991
Chromium's impact on root DNS traffic (2020),https://blog.apnic.net/2020/08/21/chromiums-impact-on-root-dns-traffic/
Why Steam Deck Is One of the Most Significant PC Gaming Moments in Years,https://www.techspot.com/article/2620-steam-deck-pc-gaming-moment/
Etsy is awash with illicit products and mass produced goods (2021),https://www.businessinsider.com/etsy-sells-ivory-weapons-poisonous-plants-mass-produced-products-2021-4
"Google is still drip-feeding AI into Search, Maps, and Translate",https://www.theverge.com/2023/2/8/23589886/google-search-maps-translate-features-updates-live-from-paris-event
"Ask HN: DNS redundancy, how to do it right?",https://news.ycombinator.com/item?id=34708066
Twitter restricted in Turkey in aftermath of earthquake,https://netblocks.org/reports/twitter-restricted-in-turkey-in-aftermath-of-earthquake-oy9LJ9B3
The Teen Mental Illness Epidemic Began Around 2012,https://jonathanhaidt.substack.com/p/the-teen-mental-illness-epidemic
Fungi and bacteria are binging on burned soil,https://news.ucr.edu/articles/2023/02/07/fungi-and-bacteria-are-binging-burned-soil
Zrok: Open-Source Peer to Peer,https://zrok.io/
Keybase.pub Shutting Down on March 1 2023,https://keybase.pub/
Why does 0.1 and 0.2 = 0.30000000000000004?,https://jvns.ca/blog/2023/02/08/why-does-0-1-plus-0-2-equal-0-30000000000000004/
The Chemistry of ‘Yes Minister’ (2017),https://sphericalbullshit.wordpress.com/2017/05/13/the-chemistry-of-yes-minister/
Google Stock Tumbles 8% After Its Bard AI Ad Shows Inaccurate Answer,https://www.investors.com/news/google-stock-falls-after-googles-bard-ai-ad-shows-inaccurate-answer/
Apple signs union agreement for Glasgow Apple Store staff,https://appleinsider.com/articles/23/02/08/apple-signs-union-agreement-for-glasgow-apple-store-staff
Acrobat PDF rendering engine added to Microsoft Edge,https://blog.adobe.com/en/publish/2023/02/08/adobe-microsoft-bring-industry-leading-acrobat-pdf-experience-window-users-microsoft-edge
Godot 4 Release Candidate 1,https://godotengine.org/article/release-candidate-godot-4-0-rc-1/
"Google will blur explicit image results for all users, requires login to disable",https://arstechnica.com/gadgets/2023/02/google-will-soon-default-to-blurring-explicit-image-search-results/
Transmission 4.0,https://transmissionbt.com
"Show HN: Filmbox, physically accurate film emulation, now on Linux and Windows",https://videovillage.co/filmbox/
OpenSSH Pre-Auth Double Free – Writeup and Proof-of-Concept,https://jfrog.com/blog/openssh-pre-auth-double-free-cve-2023-25136-writeup-and-proof-of-concept/
New neural network architecture inspired by neural system of a worm,https://www.quantamagazine.org/researchers-discover-a-more-flexible-approach-to-machine-learning-20230207/
Polynomial Interpolation,https://cohost.org/tomforsyth/post/982199-polynomial-interpola
The teen mental illness epidemic began around 2012,https://jonathanhaidt.substack.com/p/the-teen-mental-illness-epidemic
Telemetry in the Go Toolchain,https://github.com/golang/go/discussions/58409
Windows 11: a spyware machine out of users' control,https://www.techspot.com/news/97535-windows-11-spyware-machine-out-users-control.html
Buckminster Fuller’s Hall of Mirrors,https://www.thenation.com/article/culture/buckminster-fuller-alec-nevela-lee-biography/
NIST Selects ‘Lightweight Cryptography’ Algorithms to Protect Small Devices,https://www.nist.gov/news-events/news/2023/02/nist-selects-lightweight-cryptography-algorithms-protect-small-devices
Ask HN: How do you deal with information and internet addiction?,https://news.ycombinator.com/item?id=34710830
FDroid debating Aves Libre app TOS as reason for removal,https://gitlab.com/fdroid/fdroiddata/-/issues/2893
“How America took out the Nord Stream pipeline”,https://seymourhersh.substack.com/p/how-america-took-out-the-nord-stream
Vestas unveils solution to end landfill disposal for wind turbine blades,https://www.vestas.com/en/media/company-news/2023/vestas-unveils-circularity-solution-to-end-landfill-for-c3710818
Trustfall: How to Query (Almost) Everything,https://github.com/obi1kenobi/trustfall
Apache Kafka Beyond the Basics: Windowing,https://www.confluent.io/blog/windowing-in-kafka-streams/
Probiotic blocks staph bacteria from colonizing people,https://www.nih.gov/news-events/nih-research-matters/probiotic-blocks-staph-bacteria-colonizing-people
Top byte ignore for fun and memory savings,https://www.linaro.org/blog/top-byte-ignore-for-fun-and-memory-savings/
Covid drug drives viral mutations – and now some want to halt its use,https://www.nature.com/articles/d41586-023-00347-z
Zrok: Open-source peer to peer,https://zrok.io/
Transparent telemetry for open-source projects,https://research.swtch.com/telemetry-intro
Polynomial interpolation,https://cohost.org/tomforsyth/post/982199-polynomial-interpola
NIST selects ‘lightweight cryptography’ algorithms to protect small devices,https://www.nist.gov/news-events/news/2023/02/nist-selects-lightweight-cryptography-algorithms-protect-small-devices
"Hot keys, scalability, and the Zipf distribution",https://brooker.co.za/blog/2023/02/07/hot-keys.html
Update to the .NET language strategy,https://devblogs.microsoft.com/dotnet/update-to-the-dotnet-language-strategy/
Photoprism – open-source Google Photos Alternative,https://www.photoprism.app/
The entire prompt of Microsoft Bing Chat,https://twitter.com/kliu128/status/1623472922374574080
"Mary, Queen of Scots prison letters finally decoded",https://www.theguardian.com/uk-news/2023/feb/08/mary-queen-of-scots-prison-letters-finally-decoded
A Limited Interest Article on Employer Value Prop and Hiring,https://www.residentcontrarian.com/p/a-limited-interest-article-on-employer
"My 2022 self was wrong about meditation, monitors, and sleep",https://guzey.com/2022-lessons/
Show HN: StackOverflow.gg – AI-generated answers to every coding question,https://stackoverflow.gg/
Podman vs. Docker: Comparing the Two Containerization Tools – Linode,https://www.linode.com/docs/guides/podman-vs-docker/
Trentabyte's analytical way of thinking about music,https://www.gasnewsletter.com/p/49-trentabyte
Is Google’s 20-year search dominance about to end?,https://www.economist.com/business/2023/02/08/is-googles-20-year-search-dominance-about-to-end
"DIY 1,500W solar power electric bike",https://electrek.co/2022/07/24/diy-solar-power-electric-bike-1500w/
Podman vs. Docker: Comparing the two containerization tools,https://www.linode.com/docs/guides/podman-vs-docker/
Ask HN: Is “prompt injection” going to be a new common vulnerability?,https://news.ycombinator.com/item?id=34719586
Shells Are Two Things,https://borretti.me/article/shells-are-two-things
Dancing on the World’s Thin Crust: On the MIT Press’s Radium Age Series,https://lareviewofbooks.org/article/dancing-on-the-worlds-thin-crust-on-the-mit-presss-radium-age-series/
Why is remote work seen as a gift?,https://cdoyle.me/2023/02/08/why-is-remote-work-seen-as-a-gift/
Hardcoded Folder Icons in macOS,https://weblog.antranigv.am/posts/2023/02/hardcoded-folder-icons-in-macos/
Revealing the Risqué Art of Pompeii’s House of the Vettii,https://www.atlasobscura.com/articles/art-pompeii-house-of-the-vettii
Ask HN: Please Review My Metalanguage,https://github.com/kstenerud/kbnf/blob/master/kbnf_v1.md
Hack Is Wack! (2010),https://web.archive.org/web/20101222175616/http://hackiswack.com/
Ask HN: Burnt out from big tech. What's next?,https://news.ycombinator.com/item?id=34719088
I hate Hackathons,https://pgpt.substack.com/p/i-hate-hackathons
"Localbitcoins Is Shutting Down, Trading Stops Next Week",https://localbitcoins.com/service_closure/
"Ask HN: Are alternative (oil, nu, etc.) shells usable as daily drivers?",https://news.ycombinator.com/item?id=34722208
Ask HN: Is anyone else getting AI fatigue?,https://news.ycombinator.com/item?id=34722220
Generally Intelligent (YC S17) Is Hiring Engineering Managers,https://news.ycombinator.com/item?id=34722685
Magic Sand: augmented reality sandbox/playground,https://github.com/thomwolf/Magic-Sand
Mediant,https://www.johndcook.com/blog/2023/02/07/mediant-approximation-trick/
"Mukarram Jah, Heir to an Opulent Throne He Abandoned, Dies at 89",https://www.nytimes.com/2023/02/07/world/asia/mukarram-jah-dead.html
Learning How to Learn: Powerful mental tools to help you master tough subjects,https://www.coursera.org/learn/learning-how-to-learn
Gitlab to lay off 7% of staff,https://about.gitlab.com/blog/2023/02/09/gitlab-news/
Launch HN: Activepieces (YC S22) – Open-Source Zapier Alternative,https://news.ycombinator.com/item?id=34723989
My network home setup – v4.0,https://giuliomagnifico.blog/networking/2023/01/05/home-network_v4.html
"My grandmother died at home, just as she wanted. It cost $145,000",https://www.wbur.org/cognoscenti/2023/02/08/medicare-home-hospice-care-sarah-romanelli
GoDaddy Announces Layoffs of “About 8%”,https://aboutus.godaddy.net/newsroom/press-releases/press-release-details/2023/A-message-from-GoDaddy-CEO-Aman-Bhutani/default.aspx
"RustDesk – Remote desktop software, written in Rust",https://github.com/rustdesk
This site was styled by YouTube comments,https://css-comments.vercel.app/
"Something strange is happening on the sun, and we've never seen it before",https://www.vice.com/en/article/k7bm83/something-strange-is-happening-on-the-sun-and-weve-never-seen-it-before
The Undying Holiday-Suicide Myth,https://statmodeling.stat.columbia.edu/2023/02/03/the-undying-holiday-suicide-myth/
Ask HN: Are we sure LLMs are that useful in a web search application?,https://news.ycombinator.com/item?id=34723275
Shells are two things,https://borretti.me/article/shells-are-two-things
LocalBitcoins will discontinue its service,https://localbitcoins.com/service_closure/
How ‘Diversity’ Policing Fails Science,https://www.wsj.com/articles/how-diversity-policing-fails-science-equality-equity-education-texas-tech-job-candidates-interview-dei-pronouns-11675722169
The Fascinating Influence of the Cyclone Language (2019),https://pling.jondgoodwin.com/post/cyclone/
A cell cultured startup working in exotic meats (2022),https://www.foodnavigator.com/Article/2022/03/30/lion-burger-tiger-tacos-meet-the-cell-cultured-start-up-working-in-exotic-meats
What I Think About LeBron Breaking My NBA Scoring Record,https://kareem.substack.com/p/what-i-think-about-lebron-breaking
Peter Hotez on the increase of anti-science aggression on social media,https://thebulletin.org/2023/01/viral-spread-peter-hotez-on-the-increase-of-anti-science-aggression-on-social-media/#post-heading
The Mobile Phones of Doctor Who – The Motherlode of Props,https://shkspr.mobi/blog/2023/02/the-mobile-phones-of-doctor-who-the-motherlode-of-props/
Show HN: Privacy friendly suite of PDF tools,https://pdfux.com/
GPT in 60 Lines of NumPy,https://jaykmody.com/blog/gpt-from-scratch/
The UK's Online Safety Bill: An Attack on Encryption,https://element.io/blog/the-online-safety-bill-an-attack-on-encryption/
The Future of Thunderbird,https://blog.thunderbird.net/2023/02/the-future-of-thunderbird-why-were-rebuilding-from-the-ground-up/
GitHub to layoff 10% and closing all offices,https://news.ycombinator.com/item?id=34727210
ChatGPT Is a Blurry JPEG of the Web,https://www.newyorker.com/tech/annals-of-technology/chatgpt-is-a-blurry-jpeg-of-the-web
"Sabre/dav: open-source CardDAV, CalDAV and WebDAV server",https://sabre.io/
Padlet Is Hiring to Build Software for a Good Education,https://padlet.jobs
GitHub to Layoff 10%,https://twitter.com/webology/status/1623722731819659269
Comcast gave false map data to FCC–and didn’t admit it until Ars got involved,https://arstechnica.com/tech-policy/2023/02/comcast-gave-false-map-data-to-fcc-and-didnt-admit-it-until-ars-got-involved/
"Ask HN: Laid off folks, are you getting hired?",https://news.ycombinator.com/item?id=34725047
Show HN: I Made a Todo List for Developer Power Users [video],https://www.youtube.com/watch?v=pGmdX8Znv5g
“I monkey patch from time to time.”,https://medium.com/@meyborg/i-monkey-patch-from-time-to-time-13d43e47447e
Insulin is way too expensive. California has a solution: Make its own,https://www.vox.com/policy-and-politics/23574178/insulin-cost-california-biden-medicare-coverage
The Art Criticism of Jerry Saltz,https://nymag.com/author/jerry-saltz/
Perovskite-Based Thermochromic Windows Reduce Load and CO2 Emission in Buildings,https://www.nrel.gov/news/press/2023/news-release-perovskite-based-themochromic-windows-reduce-energy-load-and-carbon-emission-in-buildings.html
Voluntarily Stopping Eating and Drinking,https://www.compassionandchoices.org/our-issues/vsed
Dbt to acquire Transform to build out its semantic layer,https://www.getdbt.com/blog/dbt-acquisition-transform/
Progressively Enhanced Turbo Native Apps in the App Store,https://masilotti.com/progressively-enhanced-turbo-native-apps-in-the-app-store/
A GPT in 60 Lines of NumPy,https://jaykmody.com/blog/gpt-from-scratch/
"Show HN: boxxy – Control where Linux programs put files, without symlinks",https://github.com/queer/boxxy
The $20 an hour Cessna 172 experiment (2020),https://airfactsjournal.com/2020/11/the-20-an-hour-cessna-172-experiment/
AI Joins Hunt for ET: Study Finds 8 Potential Alien Signals,https://blogs.nvidia.com/blog/2023/02/06/ai-potential-alien-signals/
OneText (YC W23) Is Hiring a Full-Stack JavaScript Engineer,https://www.ycombinator.com/companies/onetext/jobs/VdQkXRa-first-engineer-for-onetext-new-y-combinator-fintech-startup-with-former-paypal-leads
Solar panels disguised as terracotta tiles in Pompeii,https://www.theartnewspaper.com/2023/02/06/ancient-pompeii-site-installs-invisible-solar-panels-that-look-like-roman-terracotta-tiles
Oxide and the Chamber of Mysteries [video],https://www.youtube.com/watch?v=NVZ80_tbkbc
Localizing Unity games as an indie dev,https://www.bjmalicoat.com/projects/localizingunitygames
The Online Safety Bill: An attack on encryption,https://element.io/blog/the-online-safety-bill-an-attack-on-encryption/
"Show HN: PodText.ai – Search anything said on a podcast, highlight text to play",https://podtext.ai
GitHub to lay off 10% and close all offices,https://twitter.com/webology/status/1623722731819659269
There Are Only Four Billion Floats–So Test Them All (2014),https://randomascii.wordpress.com/2014/01/27/theres-only-four-billion-floatsso-test-them-all/
Most FOSDEM 2023 videos have been uploaded,https://fosdem.org/2023/schedule/events/
ChatGPT is a blurry JPEG of the web,https://www.newyorker.com/tech/annals-of-technology/chatgpt-is-a-blurry-jpeg-of-the-web
Emacs StackExchange,https://emacs.stackexchange.com/questions?tab=Votes
Show HN: I made a tool that turns screenshots into dramatically angled photos,https://www.screenstab.com/editor/
Theory of Mind May Have Spontaneously Emerged in Large Language Models,https://arxiv.org/abs/2302.02083
Temple Student Strike Turns Ugly as School Ends Some Tuition Aid,https://www.phillymag.com/news/2023/02/08/temple-strike-philadelphia/
Image Compression with Singular Value Decomposition,http://timbaumann.info/svd-image-compression-demo/
Scientists document two separate reservoirs of latent HIV in patients,https://www.unc.edu/posts/2023/02/08/scientists-document-two-separate-reservoirs-of-latent-hiv-in-patients/
British Rail’s short experiment with travelling pubs (2020),https://www.ianvisits.co.uk/articles/british-rails-short-experiment-with-travelling-pubs-36068/
Dragon’s Lair Overhaul Black Edition (1/16th scale),https://newwavetoys.com/products/dragons-lair-x-replicade-overhaul-black
Worst Rated Dishes in the World,https://www.tasteatlas.com/100-worst-rated-dishes-in-the-world
See inside a 958-foot cargo ship (2022),https://www.businessinsider.com/cargo-ship-living-quarters-pictures-tour-youtube-video-2021-11
Comcast gave false map data to FCC,https://arstechnica.com/tech-policy/2023/02/comcast-gave-false-map-data-to-fcc-and-didnt-admit-it-until-ars-got-involved/
A new way to build with Large Language Models,https://blog.fixie.ai/introducing-fixie-ai-a-new-way-to-build-with-large-language-models-d4e1aeee6b81
Trunk-Based Development: Game Changers,https://trunkbaseddevelopment.com/game-changers/
Why big tech companies need so many people,https://thebuilderjr.substack.com/p/why-big-tech-companies-need-so-many
Housing Starts to Look the Same,https://www.nytimes.com/2023/01/20/realestate/housing-developments-city-architecture.html
