title,link
I'm Shadow Banned by DuckDuckGo (and Bing),https://daverupert.com/2023/01/shadow-banned-by-duckduckgo-and-bing/
SLT – A Common Lisp Language Plugin for Jetbrains IDE Lineup,https://github.com/Enerccio/SLT
Ask HN: How do you trust that your personal machine is not compromised?,https://news.ycombinator.com/item?id=34388866
Ubuntu 22.04 LTS servers and phased apt updates,https://utcc.utoronto.ca/~cks/space/blog/linux/Ubuntu2204ServerPhasedUpdates
Single-file scripts that download their dependencies,https://dbohdan.com/scripts-with-dependencies
"The Fourier Transform, explained in one sentence",https://blog.revolutionanalytics.com/2014/01/the-fourier-transform-explained-in-one-sentence.html
Go FOSS: Information is power,https://gofoss.net/
Constrain – Interactive figures using declarative constraint solving,https://github.com/andrewcmyers/constrain
Flightcontrol (YC W22) is hiring Developer Advocate (remote/fulltime),https://jobs.flightcontrol.dev/developer-advocate
"Porth, It's Like Forth but in Python",https://gitlab.com/tsoding/porth
I analyzed shuffling in a million games of MtG Arena (2020),https://old.reddit.com/r/MagicArena/comments/b21u3n/i_analyzed_shuffling_in_a_million_games/
Faster than the filesystem (2021),https://www.sqlite.org/fasterthanfs.html
The Inner Beauty of Basic Electronics,https://spectrum.ieee.org/open-circuits
Running KDE Plasma on RISC-V VisionFive-2,https://cordlandwehr.wordpress.com/2023/01/14/running-plasma-on-visionfive-2/
The Bibites: Artificial Life Simulation,https://leocaussan.itch.io/the-bibites
VToonify: Controllable high-resolution portrait video style transfer,https://github.com/williamyang1991/VToonify
ZSWatch – Open-source Zephyr-based smartwatch,https://github.com/jakkra/ZSWatch
Four thousand weeks,https://leebyron.com/4000/
Use.GPU Goes Trad,https://acko.net/blog/use-gpu-goes-trad/
DragonFlyBSD's HAMMER2 File-System Being Ported to NetBSD,https://www.phoronix.com/news/NetBSD-HAMMER2-Port
The joy of sets,https://www.prospectmagazine.co.uk/arts-and-books/the-joy-of-sets
Server BMCs can need to be rebooted every so often,https://utcc.utoronto.ca/~cks/space/blog/sysadmin/BMCsCanNeedRebooting
Bayesian statistics and machine learning: How do they differ?,https://statmodeling.stat.columbia.edu/2023/01/14/bayesian-statistics-and-machine-learning-how-do-they-differ/
Money creation in the modern economy (2014) [pdf],https://www.bankofengland.co.uk/-/media/boe/files/quarterly-bulletin/2014/money-creation-in-the-modern-economy.pdf?la=en&hash=9A8788FD44A62D8BB927123544205CE476E01654
"‘Excuuuuse me, Princess ’: An oral history of The Legend of Zelda cartoon",https://www.polygon.com/zelda/23540526/legend-of-zelda-cartoon-oral-history-zeldathon
Twitter API Page,https://developer.twitter.com/apitools
1991: A server-side web framework written in Forth,https://www.1-9-9-1.com/
NASA’s Double Asteroid Redirection Test Is a Smashing Success,https://eos.org/articles/nasas-double-asteroid-redirection-test-is-a-smashing-success
Janet Malcolm on the Stand,https://www.nplusonemag.com/online-only/book-review/malcolm-on-the-stand/
CircleCI says hackers stole encryption keys and customers’ source code,https://techcrunch.com/2023/01/14/circleci-hackers-stole-customer-source-code/
America’s trustbusters plan to curtail the use of non-compete clauses. Good,https://www.economist.com/leaders/2023/01/12/americas-trustbusters-plan-to-curtail-the-use-of-non-compete-clauses-good
Wobbly clock,https://somethingorotherwhatever.com/wobble-clock/
Godot for AA/AAA game development – What's missing?,https://godotengine.org/article/whats-missing-in-godot-for-aaa/
Reverse engineering a neural network's clever solution to binary addition,https://cprimozic.net/blog/reverse-engineering-a-small-neural-network/
GPT-3 Is the Best Journal I’ve Ever Used,https://every.to/superorganizers/gpt-3-is-the-best-journal-you-ve-ever-used
The Cab Ride I'll Never Forget,https://kentnerburn.com/the-cab-ride-ill-never-forget/
Show HN: Sketch – AI code-writing assistant that understands data content,https://github.com/approximatelabs/sketch
EasyPost (YC S13) Is Hiring,https://www.easypost.com/careers
Speeding up the JavaScript ecosystem part 2 – Module Resolution,https://marvinh.dev/blog/speeding-up-javascript-ecosystem-part-2/
Servo to Advance in 2023,https://servo.org/blog/2023/01/16/servo-2023/
"Show HN: Terra Firma, a playable erosion simulation",https://store.steampowered.com/app/1482770/Terra_Firma/
"ASCII table and history – Or, why does Ctrl+i insert a Tab in my terminal?",https://bestasciitable.com
Granian – a Rust HTTP server for Python applications,https://github.com/emmett-framework/granian
Wikipedia editors serving long sentences in Saudi Arabia since 2020,https://en.wikipedia.org/wiki/Wikipedia:Wikipedia_Signpost/2023-01-16/Special_report
Rendering like it's 1996 – Bitmap fonts and DOS,https://marioslab.io/posts/rendering-like-its-1996/dos-nostalgia/
The IAB loves tracking users. But it hates users tracking them,https://shkspr.mobi/blog/2023/01/the-iab-loves-tracking-users-but-it-hates-users-tracking-them/
Using paleogenomics to elucidate 10k years of immune system evolution,https://www.pasteur.fr/en/press-area/press-documents/using-paleogenomics-elucidate-10000-years-immune-system-evolution
Intro to GCC bootstrap in RISC-V,https://ekaitz.elenq.tech/bootstrapGcc0.html
"New Sony Walkman music players feature good looks, Android 12",https://arstechnica.com/gadgets/2023/01/new-sony-walkman-music-players-feature-stunning-good-looks-android-12/
Interactive Music Theory Cheat Sheet,https://muted.io/cheat-sheet/
"Selfie – A tiny RISC-V C compiler, emulator and hypervisor",http://selfie.cs.uni-salzburg.at/
Wasavi – Vi editor for any webpage,http://appsweets.net/wasavi/
The peculiar event sourced deadlock,https://jappie.me/the-peculiar-event-sourced-deadlock.html
Ask HN: When to make the jump to freelance/consultant?,https://news.ycombinator.com/item?id=34400435
Heat pumps of the 1800s are becoming the technology of the future,https://knowablemagazine.org/article/technology/2023/heat-pumps-becoming-technology-future
Rendering like it's 1996 – Baby's first pixel,https://marioslab.io/posts/rendering-like-its-1996/babys-first-pixel/
Tesla Price Drop Angers Current Owners,https://www.bloomberg.com/news/articles/2023-01-13/tesla-price-drop-angers-current-owners-as-much-as-it-hits-profit-margins
The art and science of spending money,https://collabfund.com/blog/the-art-and-science-of-spending-money/
TensorFlow for Python is dying?,https://thenextweb.com/news/why-tensorflow-for-python-is-dying-a-slow-death
Need for speed: static analysis version,https://semgrep.dev/blog/2022/static-analysis-speed
A cab ride I'll never forget (1999),https://kentnerburn.com/the-cab-ride-ill-never-forget/
Intel Core i9-13900T CPU benchmarks show faster than 12900K 125W performance,https://wccftech.com/intel-core-i9-13900t-cpu-benchmarks-show-faster-than-12900k-125w-performance-at-35w/
Conditional CSS,https://ishadeed.com/article/conditional-css/
Will Floating Point 8 Solve AI/ML Overhead?,https://semiengineering.com/will-floating-point-8-solve-ai-ml-overhead/
A Supermarket Visit Brought Down the Soviet Union,http://beelineblogger.blogspot.com/2016/01/how-supermarket-visit-brought-down.html
Rust vs. C++ Formatting,https://brevzin.github.io/c++/2023/01/02/rust-cpp-format/
Show HN: Cross-Platform GitHub Action,https://github.com/marketplace/actions/cross-platform-action
"Late Hokusai: Thought, technique, society",https://www.britishmuseum.org/research/projects/late-hokusai-thought-technique-society
TAB electronics books,https://worldradiohistory.com/BOOKSHELF-ARH/Bookshelf_TAB.htm
"GPU Caching Compared Among AMD, Intel UHD, Apple M1",https://chipsandcheese.com/2022/05/21/igpu-cache-setups-compared-including-m1/
Adventures in Mastoland,https://searchtodon.social/Adventures-in-Mastoland.html
The Cloud Conundrum: S3 Encryption,https://www.secwale.com/p/encryption
GPT-3 is the best journal I’ve used,https://every.to/superorganizers/gpt-3-is-the-best-journal-you-ve-ever-used
The IAB loves tracking users but hates users tracking them,https://shkspr.mobi/blog/2023/01/the-iab-loves-tracking-users-but-it-hates-users-tracking-them/
"Why Alexa won't wake up when hearing ""Alexa"" in Amazon's Super Bowl ad (2019)",https://www.amazon.science/blog/why-alexa-wont-wake-up-when-she-hears-her-name-in-amazons-super-bowl-ad
Brad Feld: I Don't Hate Crypto,https://feld.com/archives/2023/01/i-dont-hate-crypto/
mRNA vaccines induce higher long-term IgG4 response versus adenovirus vaccines,https://www.frontiersin.org/articles/10.3389/fimmu.2022.1020844/full?s=09#B75
MSI's (in)Secure Boot,https://dawidpotocki.com/en/2023/01/13/msi-insecure-boot/
Project Mage is an effort to build a power-user environment in Common Lisp,https://project-mage.org
Quitting the rat race,https://seanbarry.dev/posts/quitting-the-rat-race/
Major standard library changes in Go 1.20,https://blog.carlmjohnson.net/post/2023/golang-120-arenas-errors-responsecontroller/
TI-Basic interpreter written in JavaScript,https://www.davidtorosyan.com/ti-js/
The hardest part of being a junior developer,https://rachsmith.com/the-hardest-part-of-being-a-jnr/
Microsoft returns to the Altair,https://hackaday.com/2023/01/15/microsoft-returns-to-the-altair/
How my brother's iCloud account was stolen,https://7c0h.com/blog/new/stolen_iphone.html
Marriage rules in Minoan Crete revealed by ancient DNA analysis,https://phys.org/news/2023-01-marriage-minoan-crete-revealed-ancient.html
Boris Yeltsin's visit to a suburban Houston supermarket in 1989,http://beelineblogger.blogspot.com/2016/01/how-supermarket-visit-brought-down.html
"Show HN: Vento, Screen Recorder that lets you rewind and re-record over mistakes",https://vento.so
Apple TV prompt requires another Apple device,https://twitter.com/hugelgupf/status/1614794516309118977
Show HN: Otterkit – COBOL compiler for .NET,https://github.com/otterkit/otterkit
Pretty Good House,https://www.prettygoodhouse.org
Programmer salaries in the age of LLMs,https://milkyeggs.com/?p=303
"Show HN: Vento, a screen recorder that lets you rewind and record over mistakes",https://vento.so
Legit Startups – AI Generated Startup Websites,https://legit-startups.com/
Scaling Bevy Game Engine Development,https://bevyengine.org/news/scaling-bevy-development/
Blaze: A high-performance C++ math library,https://bitbucket.org/blaze-lib/blaze/src/master/
Scissors NOT Gate [video],https://www.youtube.com/watch?v=uVS7YGSKmJM
The Pretty Good House,https://www.prettygoodhouse.org
Hubble finds black hole twisting captured star into donut shape,https://phys.org/news/2023-01-hubble-hungry-black-hole-captured.html
Elliptic Curves: The Great Mystery,https://www.cantorsparadise.com/elliptic-curves-the-great-mystery-61599a93c61d
"The November 2020 landslide, tsunami, and outburst flood at Elliot Creek",https://nautil.us/the-ecological-catastrophe-youve-never-heard-of-257291/
The Whole Code Catalog (2019),https://futureofcoding.org/catalog/
"Louis Le Prince, the missing inventor of an early motion-picture camera",https://en.wikipedia.org/wiki/Louis_Le_Prince
Scaling Bevy Development,https://bevyengine.org/news/scaling-bevy-development/
Boris Yeltsin's visit to a suburban Houston supermarket in 1989 (2016),http://beelineblogger.blogspot.com/2016/01/how-supermarket-visit-brought-down.html
One man’s two-decade quest to let the ‘Irish Giant’ rest in peace,https://www.theguardian.com/culture/2023/jan/14/he-did-not-want-this-one-mans-two-decade-quest-to-let-the-irish-giant-rest-in-peace
Memory Safety Approaches Speed Up and Slow Down Development Velocity,https://verdagon.dev/blog/when-to-use-memory-safe-part-2
Louis Le Prince,https://en.wikipedia.org/wiki/Louis_Le_Prince
Building a 100% New Commodore 64 [video],https://www.youtube.com/watch?v=Qhdc-jgwqVQ
Using jlink to cross-compile minimal JREs,https://jakewharton.com/using-jlink-to-cross-compile-minimal-jres/
We Need to Know LR and Recursive Descent Parsing Techniques,https://tratt.net/laurie/blog/2023/why_we_need_to_know_lr_and_recursive_descent_parsing_techniques.html
Dijkstra Maps Visualized,http://www.roguebasin.com/index.php/Dijkstra_Maps_Visualized
The Scandal of Financial Nihilism,https://read.lukeburgis.com/p/the-scandal-of-financial-nihilism
Sirum (YC Nonprofit) Is Hiring Chief of Staff and Product Managers in Atlanta,https://sirum.org/careers/
How does it know I want CSV? – An HTTP trick,https://csvbase.com/blog/2
Safe Native Code (2015),http://joeduffyblog.com/2015/12/19/safe-native-code/
Olympic medalists in art competitions,https://en.wikipedia.org/wiki/List_of_Olympic_medalists_in_art_competitions
PHP in 2023,https://stitcher.io/blog/php-in-2023
A Solid State of Progress – Fairchild Camera and Instrument Corporation (1979),https://archive.org/details/bitsavers_fairchildAs19731979_143551798
"Twitter kicking off a developer API campaign on January 16, 2023",https://carhenge.club/@mattdsteele/109700383808551139
Apple Unveils MacBook Pro Featuring M2 Pro and M2 Max,https://www.apple.com/newsroom/2023/01/apple-unveils-macbook-pro-featuring-m2-pro-and-m2-max/
New Mac Mini,https://www.apple.com/mac-mini/
Ruby 3.2’s YJIT is Production-Ready,https://shopify.engineering/ruby-yjit-is-production-ready
Byte Magazine 1975-1995,https://worldradiohistory.com/Byte_Magazine.htm
Ask HN: Books that teach programming by building a series of small projects?,https://news.ycombinator.com/item?id=34412069
New Mac Mini (M2) and MacBook Pro (M2 Pro/Max),https://www.apple.com/mac/
The FBI Identified a Tor User,https://www.schneier.com/blog/archives/2023/01/the-fbi-identified-a-tor-user.html
The Next Button,https://maxhodak.com/nonfiction/2023/01/14/the-next-button.html
Show HN: Cosh – concatenative command-line shell,https://github.com/tomhrr/cosh
Dr V’s Magical Putter (2014),https://grantland.com/features/a-mysterious-physicist-golf-club-dr-v/
Tell HN: Gmail's spam filters have gone bonkers,https://news.ycombinator.com/item?id=34411009
MacBook Pro featuring M2 Pro and M2 Max,https://www.apple.com/newsroom/2023/01/apple-unveils-macbook-pro-featuring-m2-pro-and-m2-max/
Diskless infrastructure in beta (System Transparency: stboot),https://mullvad.net/en/blog/2022/1/12/diskless-infrastructure-beta-system-transparency-stboot/
"Tesla video promoting self-driving was staged, engineer testifies",https://www.reuters.com/technology/tesla-video-promoting-self-driving-was-staged-engineer-testifies-2023-01-17/
My grandfather was almost shot down by ground to air missiles at the Whitehouse (2018),https://nones-leonard.medium.com/flying-high-8536fa403324
GNU make 4.4 adds --shuffle to help find parallel build issues,https://trofi.github.io/posts/238-new-make-shuffle-mode.html
Laser desorption mass spectrometry – Alien detector that fits in your hand,https://www.nature.com/articles/s41550-022-01866-x
"Patterns, the fastest way to build, scale cloud apps, is hiring",https://www.patterns.app/
UK lawmakers vote to jail tech execs who fail to protect kids online,https://arstechnica.com/tech-policy/2023/01/uk-lawmakers-vote-to-jail-tech-execs-who-fail-to-protect-kids-online/
"It's time to put cancer warning labels on alcohol, experts say",https://www.cbc.ca/news/health/alcohol-cancer-risk-warning-1.6715769
Glitching a Microcontroller to Unlock the Bootloader,https://grazfather.github.io/posts/2019-12-08-glitcher/
Faster virtual machines: Speeding up programming language execution,https://mort.coffee/home/fast-interpreters/
Muse: Text-to-Image Generation via Masked Generative Transformers,https://muse-model.github.io/
Ask HN: Has anyone worked at the US National Labs before?,https://news.ycombinator.com/item?id=34414527
Ask HN: What interesting people are you following on Mastodon?,https://news.ycombinator.com/item?id=34413641
Microsoft launches Azure OpenAI service with ChatGPT coming soon,https://www.theverge.com/2023/1/17/23558530/microsoft-azure-openai-chatgpt-service-launch
What's Ahead for U.S. Propane Marketers in Winter 2022-23?,https://bpnews.com/supply/whats-ahead-propane-marketers-winter-2022-23
Git Security Vulnerabilities Announced,https://github.blog/2023-01-17-git-security-vulnerabilities-announced-2/
EV batteries alone could satisfy short-term grid storage demand as early as 2030,https://www.nature.com/articles/s41467-022-35393-0
Stadia Bluetooth Mode,https://stadia.google.com/controller/
"Microsoft to lay off 11,000 employees",https://www.reuters.com/technology/microsoft-cut-thousands-jobs-sky-news-2023-01-17/
A new CT scan to detect and cure the commonest cause of high blood pressure,https://www.qmul.ac.uk/media/news/2023/smd/ten-minute-scan-enables-detection-and-cure-of-the-commonest-cause-of-high-blood-pressure.html
Show HN: Plus – Self Updating Screenshots,https://www.plusdocs.com/
What’s Going on in the World of Extensions,https://blog.mozilla.org/en/products/firefox/extensions-addons/heres-whats-going-on-in-the-world-of-extensions/
Common Lisp and Music Composition,https://ldbeth.sdf.org/articles/cm.html
Pegasus: A Spy in Your Pocket Threatens the End of Privacy,https://www.tatteredcover.com/book/9781250858696
What Is Our Universe Expanding Into?,https://nautil.us/what-is-our-universe-expanding-into-258168/
Losing Taiwan Means Losing Japan,https://scholars-stage.org/losing-taiwan-means-losing-japan/
Show HN: A tool for motion-capturing 3D characters using a VR headset,https://diegomacario.github.io/Hands-In-The-Web/public/index.html
Patterns (YC S21) is hiring,https://www.patterns.app/
The Quest for a Dumber Phone,https://every.to/cybernaut/the-quest-for-a-dumber-phone
Show HN: Product Hunt Launch Dashboard,https://plusdocs.notion.site/Public-Beta-Launch-Dashboard-c5a62f9a22c245b888ee6e71061fdce2
Republicans to pass bill in House to end telework for federal employees,https://www.wusa9.com/article/news/local/dc/show-up-act-federal-workers-telework-bill/65-11d0e826-21c4-4a2e-96ba-1741637411d2
New make --shuffle mode,https://trofi.github.io/posts/238-new-make-shuffle-mode.html
The Amagasaki Derailment [video],https://www.youtube.com/watch?v=vfWUgkWh784&list=UULFFXad0mx4WxY1fXdbvtg0CQ
ChrysaLisp,https://github.com/vygr/ChrysaLisp
UT-Austin blocks access to TikTok on campus Wi-Fi networks,https://www.texastribune.org/2023/01/17/ut-austin-tiktok-ban/
My grandfather was almost shot down at the White House (2018),https://nones-leonard.medium.com/flying-high-8536fa403324
Diskless infrastructure in beta (System Transparency: stboot) (2022),https://mullvad.net/en/blog/2022/1/12/diskless-infrastructure-beta-system-transparency-stboot/
The Underground Cooks of Singapore’s Prisons,https://www.atlasobscura.com/articles/prison-cooking-singapore
The Art of Knowing When to Quit,https://blog.jim-nielsen.com/2023/art-of-knowing-when-to-quit/
Hyundai Head Unit Hacking,https://xakcop.com/post/hyundai-hack-2/
How Do AIs' Political Opinions Change as They Get Smarter and Better-Trained?,https://astralcodexten.substack.com/p/how-do-ais-political-opinions-change
Tailscale bug allowed a person to share nodes from other tailnets without auth,https://tailscale.com/security-bulletins/#ts-2023-001/
A flurry of new studies identifies causes of the Industrial Revolution,https://www.economist.com/graphic-detail/2023/01/17/a-flurry-of-new-studies-identifies-causes-of-the-industrial-revolution
Bike helmets: what the science says about an American safety obsession,https://slate.com/technology/2023/01/bike-helmets-cyclist-deaths-do-you-need-to-wear.html
Show HN: Plus – Self-updating screenshots,https://www.plusdocs.com/
"Let's build GPT: from scratch, in code, spelled out by Andrej Karpathy [video]",https://www.youtube.com/watch?v=kCc8FmEb1nY
I Am the Ghost Here,https://www.guernicamag.com/i-am-the-ghost-here/
Is a venture studio right for you?,https://steveblank.com/2023/01/17/is-a-venture-studio-right-for-you/
The ThinkPad TrackPoint tried to build a better mouse (2020),https://www.theverge.com/circuitbreaker/2020/6/30/21292182/thinkpad-trackpoint-mouse-nub-button-trackpad-challenges-design-user-input
Dell Tried to Hide Bad Capacitors Problem 2003-2005 (2010),https://spectrum.ieee.org/dell-tried-to-hide-bad-capacitors-problem
We could stumble into AI catastrophe,https://forum.effectivealtruism.org/posts/yjm5CW9JdwBTFZB2B/how-we-could-stumble-into-ai-catastrophe
Git security vulnerabilities announced,https://github.blog/2023-01-17-git-security-vulnerabilities-announced-2/
A Stack of Feed-Forward Layers Does Surprisingly Well on ImageNet,https://arxiv.org/abs/2105.02723
Cultivating Depth and Stillness in Research,https://andymatuschak.org/stillness/
The Metapict Blog – TikZ like figures using Racket,https://soegaard.github.io/blog/metapict/
Show HN: Stack-chan – Open-source companion robot easy to assemble and customize,https://github.com/meganetaaan/stack-chan
Glitching a microcontroller to unlock the bootloader,https://grazfather.github.io/posts/2019-12-08-glitcher/
A Not-So-Brief History of the United States Navy Steel Band,https://www.panonthenet.com/exclusive/2011/navy-poole-4-12-2011.htm
A new scan to detect and cure the commonest cause of high blood pressure,https://www.qmul.ac.uk/media/news/2023/smd/ten-minute-scan-enables-detection-and-cure-of-the-commonest-cause-of-high-blood-pressure.html
LangChain: Build AI apps with LLMs through composability,https://github.com/hwchase17/langchain
A stack of feed-forward layers does surprisingly well on ImageNet,https://arxiv.org/abs/2105.02723
Smithsonian will restore hundreds of the oldest sound recordings,https://www.smithsonianmag.com/smart-news/smithsonian-will-restore-nearly-300-never-before-heard-recordings-by-alexander-graham-bell-180981440/
Show HN: Summate.it – Quickly summarize web articles with OpenAI,https://summate.it/?v2
"Show HN: I made a tool, create GitHub Repository from local directory directly",https://github.com/shunak/wfh
Feature flags in a CI pipeline,https://andydote.co.uk/2023/01/16/feature-flags-ci/
Printable Puzzle Project,https://www.puzzlehub.org/
The art of knowing when to quit,https://blog.jim-nielsen.com/2023/art-of-knowing-when-to-quit/
A Not-So-Brief History of the United States Navy Steel Band (2011),https://www.panonthenet.com/exclusive/2011/navy-poole-4-12-2011.htm
GPT-3.5 and Wolfram Alpha via LangChain,https://huggingface.co/spaces/JavaFXpert/Chat-GPT-LangChain
"Ask HN: Techwise, how did TikTok get so good?",https://news.ycombinator.com/item?id=34421594
Stop feeding the hype and start resisting,https://irisvanrooijcogsci.com/2023/01/14/stop-feeding-the-hype-and-start-resisting/
Japanese manhole mass production process [video],https://www.youtube.com/watch?v=9OYPWgzDBxE
The terminal escape sequences ocean is deep and dark,https://www.ethanheilman.com/x/28/index.html
No Start Menu for You,https://randomascii.wordpress.com/2023/01/17/no-start-menu-for-you/
"Venice’s lagoon of 2,000 lost boats",https://www.theguardian.com/environment/2023/jan/10/venices-lagoon-of-2000-lost-boats-the-true-cost-of-dumping-small-vessels
Show HN: Metapict – TikZ like figures using Racket,https://soegaard.github.io/blog/metapict/
Fast DataFrames for Ruby,https://github.com/ankane/polars-ruby
DensePose from WiFi,https://arxiv.org/abs/2301.00250
Meet “Claude”: Anthropic’s rival to ChatGPT,https://scale.com/blog/chatgpt-vs-claude
Datasette is my data hammer,https://www.jeremiak.com/blog/datasette-the-data-hammer/
Screenshots as the Universal API,https://matt-rickard.com/screenshots-as-the-universal-api
What's the right UX for an expired certificate?,https://emilymstark.com/2023/01/16/whats-the-right-ux-for-an-expired-certificate.html
"In the past, I've had students call my problem sets “emotionally trying”",https://twitter.com/shengwuli/status/1614637276113563648
WebGL Fluid Simulation,https://paveldogreat.github.io/WebGL-Fluid-Simulation/
Typst: A Programmable Markup Language for Typesetting [pdf],https://www.user.tu-berlin.de/laurmaedje/programmable-markup-language-for-typesetting.pdf
Thonny – Python IDE for new to programming,https://thonny.org
"Hello, PNG",https://www.da.vidbuchanan.co.uk/blog/hello-png.html
How to Create Luck,https://www.swyx.io/create-luck/
How Blogs Broke the Web,https://stackingthebricks.com/how-blogs-broke-the-web/
Source code for Dutch DigiD app released under Dutch Open Government Act,https://github.com/MinBZK/woo-besluit-broncode-digid-app
Cruel optimism and lazy pessimism,https://tegowerk.eu/posts/cruel-optimism/
Formalizing the H-Principle and Sphere Eversion,https://dl.acm.org/doi/abs/10.1145/3573105.3575688
US startup's bladeless VTOL can reach up to 0.8 Mach,https://interestingengineering.com/transportation/us-startups-bladeless-vtol-can-reach-up-to-08-mach
Thonny – Python IDE for beginners,https://thonny.org
"U-config – A new, lean pkg-config clone",https://nullprogram.com/blog/2023/01/18/
`tar` creator/extractor in ~100 lines of Prolog,https://github.com/SuperDisk/tar.pl
ReactOS,https://reactos.org/
Loss of epigenetic information as a cause of mammalian aging,https://www.cell.com/cell/fulltext/S0092-8674(22)01570-7
OpenAI Used Kenyan Workers on Less Than $2 per Hour to Make ChatGPT Less Toxic,https://time.com/6247678/openai-chatgpt-kenya-workers/
Restoring a Vintage Rolex GMT,https://www.youtube.com/watch?v=la2ztR5askE
Microsoft to lay off 10k workers,https://blogs.microsoft.com/blog/2023/01/18/subject-focusing-on-our-short-and-long-term-opportunity/
Create optimal conditions for lucky things to happen to you (2020),https://www.swyx.io/create-luck/
A Human-Centered Approach to Developer Productivity,https://ieeexplore.ieee.org/document/9994260
Apple HomePod 2nd Generation,https://www.apple.com/homepod-2nd-generation/
Ask HN: What have you built more than twice and wish someone had built for you?,https://news.ycombinator.com/item?id=34427143
