title,link
macOS CLI tool to configure multi-display resolutions and arrangements,https://github.com/jakehilborn/displayplacer
BuildZoom (better way to build custom homes) Is hiring a Principal Engineer,https://jobs.lever.co/buildzoom
Japan: The Harbinger State,https://www.cambridge.org/core/journals/japanese-journal-of-political-science/article/japan-the-harbinger-state/2A9123B64A04C480B1BC5669FC2C8AF3
How do ADHD people cope on here?,https://news.ycombinator.com/item?id=34486848
Medical History Books,https://scottlocklin.wordpress.com/2022/12/21/medical-history-books/
Coding Curves: Superellipses and Superformulas,https://www.bit-101.com/blog/2023/01/coding-curves-13-superellipses-and-superformulas/
OpenAI and Microsoft extend partnership,https://openai.com/blog/openai-and-microsoft-extend-partnership/
An intutive counterexample to the axiom of choice,http://blog.rongarret.info/2023/01/an-intutive-counterexample-to-axiom-of.html
‘Sensational’ runestone discovered in Norway may be the world’s oldest,https://www.smithsonianmag.com/smart-news/sensational-runestone-discovered-in-norway-may-be-the-worlds-oldest-180981470/
Show HN: Companies hiring remote software engineers anywhere in the world,https://www.remoterocketship.com/companies-hiring-worldwide/software-engineers
Spotify reducing employee base by about 6%,https://newsroom.spotify.com/2023-01-23/an-update-on-january-2023-organizational-changes/
Windows 3.x Vddvga,http://www.os2museum.com/wp/windows-3-x-vddvga/
Git commands you probably do not need,https://myme.no/posts/2023-01-22-git-commands-you-do-not-need.html
The Last Days of Hollywood’s Most Reviled Reporter,https://www.nytimes.com/2023/01/21/style/nikki-finke-hollywood-journalist.html
Deepmind is working on a rival to ChatGPT,https://techfundingnews.com/chatgpt-killer-google-owned-uk-born-ai-startup-deepmind-is-working-on-a-rival/
Ask HN: When did GitHub replace standard Git commands with the “GitHub CLI?”,https://news.ycombinator.com/item?id=34489301
Ask HN: How do ADHD people cope on here?,https://news.ycombinator.com/item?id=34486848
Fewer people are creating new podcasts these days,https://philsiarri.substack.com/p/way-fewer-people-are-creating-new
"10,500-Year-Old Settlement of Hunter-Gatherers Unearthed in Britain",https://www.sci.news/archaeology/hunter-gatherer-settlement-britain-11584.html
"Zero to Nix, an unofficial, opinionated, gentle introduction to Nix",https://zero-to-nix.com/
Netflix's New Chapter,https://stratechery.com/2023/netflixs-new-chapter/
Stripe Extends Partnership with Amazon,https://stripe.com/en-es/newsroom/news/amazon-and-stripe
US Construction worker productivity has dropped 40% in the last 50 years,https://bfi.uchicago.edu/insight/finding/the-strange-and-awful-path-of-productivity-in-the-us-construction-sector/
Perplexity.ai Prompt Leakage,https://twitter.com/jmilldotdev/status/1600624362394091523
John le Carré’s Search for a Vocation,https://www.newyorker.com/books/page-turner/john-le-carres-search-for-a-vocation
"ChatCody, the GitHub Bot That Boosts Team Productivity",https://github.com/marketplace/chatcody
Fentanyl vaccine tested in rats,https://uh.edu/news-events/stories/2022-news-articles/november-2022/11142022-fentanyl-vaccine-haile-kosten.php
Pure Java Typesetting System,https://github.com/DaveJarvis/KeenType
NASA Solved a $100M Problem for Five Bucks,https://gizmodo.com/how-nasa-solved-a-100-million-problem-for-five-bucks-5880850
Ask HN: How do you balance support and sprint tickets?,https://news.ycombinator.com/item?id=34488938
Show HN: Shite: The little hot-reloadin' static site maker from shell,https://github.com/adityaathalye/shite
"Commercial 3D printers emit traces of toxic fumes, study finds",https://eandt.theiet.org/content/articles/2019/10/commercial-3d-printers-emit-traces-of-toxic-fumes-study-finds/
Microsoft and OpenAI extend partnership,https://blogs.microsoft.com/blog/2023/01/23/microsoftandopenaiextendpartnership/
"OpenEnroth – Open reimplementation of the Might and Magic 6, 7, 8 game engine",https://github.com/OpenEnroth/OpenEnroth
Astronautilia,https://en.wikipedia.org/wiki/Astronautilia
A custom-designed IDE SSD for old PCs,https://github.com/dosdude1/2.5-inch-ide-ssd
Reverse-engineering the conditional jump circuitry in the 8086 processor,https://www.righto.com/2023/01/reverse-engineering-conditional-jump.html
Perplexity.ai prompt leakage,https://twitter.com/jmilldotdev/status/1600624362394091523
Relationship Hero (YC S17) Is Hiring Sales Associates – Remote,https://relationshiphero.com/careers?role=salesAssociate
Wonders of Street View,https://neal.fun/wonders-of-street-view/
Pwning the all Google phone with a non-Google bug,https://github.blog/2023-01-23-pwning-the-all-google-phone-with-a-non-google-bug/
An Overview of Ruby on Rails 7.1 Features. Part III,https://manny.codes/this-week-in-rails-wrapped-an-overview-of-rails-7-1-features-part-iii/
KeenType: Pure Java typesetting system,https://github.com/DaveJarvis/KeenType
Paper map sales are booming,https://www.wsj.com/articles/why-paper-map-sales-are-booming-11674164824
Antique Roman Dishes – Collection (1993),http://www.cs.cmu.edu/~mjw/recipes/ethnic/historical/ant-rom-coll.html
An incomplete guide to stealth addresses,https://vitalik.ca/general/2023/01/20/stealth.html
Expanding Features for End-to-End Encryption on Messenger,https://about.fb.com/news/2023/01/expanding-features-for-end-to-end-encryption-on-messenger/
In Search of Lost Art: Kurt Schwitters’s Merzbau (2012),https://www.moma.org/explore/inside_out/2012/07/09/in-search-of-lost-art-kurt-schwitterss-merzbau/
John le Carré’s search for a vocation,https://www.newyorker.com/books/page-turner/john-le-carres-search-for-a-vocation
Chess is booming and our servers are struggling,https://www.chess.com/blog/CHESScom/chess-is-booming-and-our-servers-are-struggling
Runestone discovered in Norway may be the world’s oldest,https://www.smithsonianmag.com/smart-news/sensational-runestone-discovered-in-norway-may-be-the-worlds-oldest-180981470/
NASA solved a $100M problem for five bucks (2012),https://gizmodo.com/how-nasa-solved-a-100-million-problem-for-five-bucks-5880850
Show HN: Shite – little hot-reloadin' static site maker from shell,https://github.com/adityaathalye/shite
The failed promises of tech liberation,https://flux.community/matthew-sheffield/2023/01/richard-barbrook-californian-ideology-libertarianism-neoliberalism/
Amazon-Stripe partnership,https://stripe.com/en-es/newsroom/news/amazon-and-stripe
AsciiMath: An easy-to-write markup language for mathematics,http://asciimath.org
Doomgeneric: Make Porting Doom Easier,https://github.com/ozkl/doomgeneric
Setting the clock ahead to see what breaks,https://rachelbythebay.com/w/2023/01/19/time/
About Security Keys for Apple ID,https://support.apple.com/en-us/HT213154
Emulating Win32,https://neugierig.org/software/blog/2023/01/emulating-win32.html
GitHub Sponsors will stop supporting PayPal,https://github.blog/changelog/2023-01-23-github-sponsors-will-stop-supporting-paypal/
"A dozen USB chargers in the lab: Apple is good, but not quite the best (2012)",https://www.righto.com/2012/10/a-dozen-usb-chargers-in-lab-apple-is.html
Has Earth’s inner core stopped its strange spin?,https://www.nature.com/articles/d41586-023-00167-1
The Disappearance of the Ashtray,https://clivethompson.medium.com/the-disappearance-of-the-ashtray-4badc1be9e3b
Dissolution Foretold: A neurosurgeon on the reality of his diagnosis,https://lithub.com/dissolution-foretold-neurosurgeon-henry-marsh-on-the-reality-of-his-own-diagnosis/
How we turned the tables to catch my sister’s Bumble stalker,https://major-grooves.medium.com/how-we-turned-the-tables-to-catch-my-sisters-bumble-stalker-e1979d39670d
"Commercial 3D printers emit traces of toxic fumes, study finds (2019)",https://eandt.theiet.org/content/articles/2019/10/commercial-3d-printers-emit-traces-of-toxic-fumes-study-finds/
Is tipping getting out of control? Many consumers say yes,https://apnews.com/article/tipping-fatigue-business-c4ae9d440610dae5e8ff4d4df0f88c35
Bitwarden design flaw: Server side iterations,https://palant.info/2023/01/23/bitwarden-design-flaw-server-side-iterations/
Doomgeneric: Make porting Doom easier,https://github.com/ozkl/doomgeneric
International domain names: where does https://meßagefactory.ca lead you?,https://lemire.me/blog/2023/01/23/international-domain-names-where-does-https-mesagefactory-ca-lead-you/
Emulating win32,https://neugierig.org/software/blog/2023/01/emulating-win32.html
How Equifax Became a Private IRS,https://mattstoller.substack.com/p/how-equifax-became-a-private-irs
Synchronous Observation of Bell Nonlocality and State-Dependent Contextuality,https://journals.aps.org/prl/abstract/10.1103/PhysRevLett.130.040201
Competing Paradigms: On “The Last Writings of Thomas S. Kuhn”,https://lareviewofbooks.org/article/competing-paradigms-on-the-last-writings-of-thomas-s-kuhn/
Blind Spots: Automatically detecting ignored program inputs,https://arxiv.org/abs/2301.08700
OpenDolphin: Contribute to a truly open social network,https://about.opendolphin.social/
Why the infosec community is ahead of the curve and rationalists and nihilists,https://ioc.exchange/@invisv/109740474201888576
Blizzard manager departs in protest of employee ranking system,https://www.bloomberg.com/news/articles/2023-01-23/blizzard-manager-departs-in-protest-of-employee-ranking-system
Investor sends letter to Google demanding more people fired and pay reduced,https://www.teamblind.com/post/Google-investor-TCI-asking-for-more-layoffs-Hdbc5SGQ
Worshipping at the Altar of Artificial Intelligence,https://jessicadefino.substack.com/p/lensa-ai-portraits-beauty-standards
Ask HN: Why do you find your job satisfying?,https://news.ycombinator.com/item?id=34499286
"If you find this world bad, you should see some of the others (1977) [pdf]",https://ia903105.us.archive.org/7/items/philip.k.dickif.you.find.this.world.bad.you.should.see.some.of.the.others/Philip.K.Dick-If.You.Find.This.World.Bad.You.Should.See.Some.Of.The.Others.pdf
Ask HN: ‘Following’ Other HN Users?,https://news.ycombinator.com/item?id=34499574
"Elastic, Loki and SigNoz – A Perf Benchmark of Open-Source Logging Platforms",https://github.com/SigNoz/logs-benchmark
Stacker (YC S20) is hiring a strategic Product Designer,https://apply.workable.com/stackerhq/j/315EE1DB57/
Build security with the assumption it will be used against your friends,https://mjg59.dreamwidth.org/65272.html
Hyperscale in your Homelab: The Compute Blade arrives,https://www.jeffgeerling.com/blog/2023/hyperscale-your-homelab-compute-blade-arrives
Japan PM’s solution to dire birthrate has already been rejected by young,https://www.theguardian.com/world/2023/jan/24/japan-birthrate-population-pm-solution-already-rejected-by-young
Minimal Cross-Platform Graphics,https://zserge.com/posts/fenster/
Marp: Markdown Presentation Ecosystem,https://marp.app/
OneText (YC W23) is hiring our first engineer,https://www.ycombinator.com/companies/onetext/jobs/VdQkXRa-first-engineer-for-onetext-new-y-combinator-fintech-startup-with-former-paypal-leads
"Linear-log bucketing: fast, versatile, simple (2015)",https://pvk.ca/Blog/2015/06/27/linear-log-bucketing-fast-versatile-simple/
TIPP10 – Free Touch Typing Tutor,https://www.tipp10.com/en/index/
Code reviews need to shift-left,https://sourcery-ai.medium.com/code-reviews-need-to-shift-left-ef76fb161a1b
Apple attempting to stop investigation into its practices involving Browsers,https://twitter.com/openwebadvocacy/status/1617802614149894144
Encrypting Data in the Browser Using WebAuthn,https://blog.millerti.me/2023/01/22/encrypting-data-in-the-browser-using-webauthn/
German cartel office initiates proceedings against PayPal,https://www.reuters.com/legal/german-cartel-office-initiates-proceedings-against-paypal-2023-01-23/
Ask HN: Airbnb requires my credit-card transaction history?,https://news.ycombinator.com/item?id=34499044
Certified 100% AI-free organic content,https://substack.piszek.com/p/ai-free
How to get new ideas,http://paulgraham.com/getideas.html
GPT is all you need for the back end,https://github.com/TheAppleTucker/backend-GPT
TIL you can de-obfuscate code with ChatGPT,https://twitter.com/AlexAlexandrius/status/1617876020593557506
Ask HN: What is the weirdest or most surreal recent technology you have seen?,https://news.ycombinator.com/item?id=34502566
Internet Archive takes down upload of BBC’s Modi documentary,https://www.thehindu.com/news/national/internet-archive-takes-down-upload-of-bbcs-modi-documentary/article66425460.ece
CNET's AI Journalist Appears to Have Committed Extensive Plagiarism,https://futurism.com/cnet-ai-plagiarism
Gitpod has laid off 28% of the company which is circa 21 employees,https://twitter.com/geoffreyhuntley/status/1617878457807167494
Ask HN: ML Papers to Implement,https://news.ycombinator.com/item?id=34503362
The current layoffs were orchestrated by hedge funds,https://m6n.io/@fuzzychef/109740778756656452
On Markdown in Java documentation comments,https://mail.openjdk.org/pipermail/javadoc-dev/2023-January/005563.html
Launch HN: Matano (YC W23) – Open-Source Security Lake Platform (SIEM) for AWS,https://news.ycombinator.com/item?id=34505603
"NYC Jails Want to Ban Physical Mail, Then Privatize Scanning of Digital Versions",https://theintercept.com/2023/01/23/nyc-jail-rikers-mail-surveillance-securus/
Genome-wide RNA polymerase stalling shapes the transcriptome during aging,https://www.researchhub.com/paper/1274552/genome-wide-rna-polymerase-stalling-shapes-the-transcriptome-during-aging
Making sense of TypeScript using set theory,https://blog.thoughtspile.tech/2023/01/23/typescript-sets/
Wine 8.0,https://www.winehq.org/announce/8.0
Replit (YC W18) Is Hiring First Developer Advocate,https://jobs.ashbyhq.com/replit/434075ed-aa4c-4a42-b2ad-fa1242817e7d
ChatGPT Cheat Sheet,https://drive.google.com/file/d/1UOfN0iB_A0rEGYc2CbYnpIF44FupQn2I/view?usp=share_link
"The Git source code audit, viewed as a Rust programmer",https://litchipi.github.io/infosec/2023/01/24/git-code-audit-viewed-as-rust-programmer.html
Make a Resume in LaTeX,https://drshika.me/2022/04/15/latex-resumes
PagerDuty to Lay Off 7% of Staff; Revenue Officer to Exit,https://www.marketwatch.com/story/pagerduty-to-lay-off-7-of-staff-revenue-officer-to-exit-271674568511
"Jan Valtin’s 1941 memoir of revolutionary fervor, suffering, and lost faith",https://thebaffler.com/latest/unflinching-prisoners-of-a-grandiose-make-believe-asher
"Ask HN: Self-hosting in 2023: Nextcloud on Linode, or...?",https://news.ycombinator.com/item?id=34503176
Corpse Medicine,https://collation.folger.edu/2023/01/corpse-medicine/
U.S. Accuses Google of Abusing Monopoly in Ad Technology,https://www.nytimes.com/2023/01/24/technology/google-ads-lawsuit.html
"Life and work of the great Visionary, Homi J. Bhabha",https://artsandculture.google.com/story/life-and-work-of-the-great-visionary-homi-j-bhabha-tata-institute-of-fundamental-research/swVxRxSI7wMA8A?hl=en
Kysely: TypeScript SQL Query Builder,https://github.com/koskimas/kysely
"Tell HN: Thank you for being fast, ad-free and text only",https://news.ycombinator.com/item?id=34505219
Riot: Source code for League of Legends and TFT were exfiltrated by attackers,https://threadreaderapp.com/thread/1617900234734198787.html
Cal.com: Open-Source Calendly Alternative,https://cal.com/
How the Xbox 360 knows if your hard drive is genuine,https://eaton-works.com/2023/01/24/how-the-xbox-360-knows-if-your-hard-drive-is-genuine/
Making chloroform so I can sleep better at night [video],https://www.youtube.com/watch?v=L23akTkDqTM
"Seven years on, what do we know about the disappearance of flight MH370? (2021)",https://admiralcloudberg.medium.com/call-of-the-void-seven-years-on-what-do-we-know-about-the-disappearance-of-malaysia-airlines-77fa5244bf99
Jerry (YC S17) is hiring a senior product designer (remote),https://jobs.ashbyhq.com/Jerry/0a1e6878-1f8d-443e-aaad-fcdd97ee1829?departmentId=35139ec5-efdf-4d54-bbfb-47d24a37e6e2
Companies use drip pricing to overcharge consumers,https://passingtime.substack.com/p/perfidious-pricing
Show HN: Turning books into chatbots with GPT-3,https://www.konjer.xyz/
Some gut bacteria appear to communicate with the brain,https://www.bbc.com/future/article/20230120-how-gut-bacteria-are-controlling-your-brain
Strings in YAML – To quote or not to quote (2018),https://blogs.perl.org/users/tinita/2018/03/strings-in-yaml---to-quote-or-not-to-quote.html
U.S. accuses Google of abusing monopoly in ad technology,https://www.nytimes.com/2023/01/24/technology/google-ads-lawsuit.html
A Perceptually Meaningful Audio Visualizer (2016),https://delu.medium.com/a-perceptually-meaningful-audio-visualizer-ee72051781bc
Tweak New Twitter,https://github.com/insin/tweak-new-twitter
Mac Malware of 2022,https://objective-see.org/blog/blog_0x71.html
Unflinching prisoners of a grandiose make-believe,https://thebaffler.com/latest/unflinching-prisoners-of-a-grandiose-make-believe-asher
Show HN: Realtime GPU-powered implicit function plotter in your browser,https://plotf.xyz/
Astro 2.0,https://astro.build/blog/astro-2/
Snowden on the Lightning Network on Nostr,https://iris.to/#/post/note1scags6u8fre3rhyc9h457wdrhu0r2c0h4t4e4d4nrwsjj6mcg2qqc2k7am
Appliance makers sad that 50% of customers won’t connect smart appliances,https://arstechnica.com/gadgets/2023/01/half-of-smart-appliances-remain-disconnected-from-internet-makers-lament/
Cal.com: Open Scheduling Infrastructure,https://cal.com/
Stanford's New Study Validates Ancient Breathing Technique,https://superself.substack.com/p/stanfords-ancient-breathing-technique
Mystery Signal from a Helicopter (2014),https://www.windytan.com/2014/02/mystery-signal-from-helicopter.html
Fast JavaScript-to-WASM Call from FTL,https://github.com/WebKit/WebKit/pull/8607
Re-Adding SMS Support to Signal,https://github.com/ryukoposting/Signal-Android/tree/fork-5.53.8
How to Prioritize Tasks?,https://jimmyislive.dev/posts/how-to-prioritize/
Show HN: Infisical – open-source secrets manager for developers,https://infisical.com/
The Chertsey Tiles,https://chertseytiles.holycross.edu/the-chertsey-tiles/
"Oberon-2, a hi-performance alternative to C++ (1997)",https://folk.ntnu.no/haugwarb/Programming/Oberon/oberon_vs_cpp_II.htm
Karl Jaspers: the forgotten father of existentialism,https://aeon.co/essays/karl-jaspers-the-forgotten-father-of-existentialism
"Bulldozer, AMD’s Crash Modernization: Caching and Conclusion",https://chipsandcheese.com/2023/01/24/bulldozer-amds-crash-modernization-caching-and-conclusion/
"NASA, DARPA will test nuclear engine for future Mars missions",https://www.nasa.gov/press-release/nasa-darpa-will-test-nuclear-engine-for-future-mars-missions/
UK proposal to criminalize “sophisticated encrypted communication devices”,https://assets.publishing.service.gov.uk/government/uploads/system/uploads/attachment_data/file/1130978/2023_SOC_Measures_Consultation_Document_-_Final.pdf#page=14
Apple issues security update for the almost 10-year-old iPhone 5S,https://www.theverge.com/2023/1/24/23569600/apple-iphone-5s-security-update-ios-12
Three Bugs in the Go MySQL Driver,https://github.blog/2020-05-20-three-bugs-in-the-go-mysql-driver/
Ibn Battuta: A Scholar's Epic Journey,https://www.jurnalanas.com/blog/2018-03-24-ibn-battuta-and-his-journey
The Story behind ASINs (Amazon Standard Identification Numbers),https://inventlikeanowner.com/blog/the-story-behind-asins-amazon-standard-identification-numbers/
On the Algebraic Properties of Flame Graphs,https://arxiv.org/abs/2301.08941
Ask HN: What are the worst names given to employees of specific companies?,https://news.ycombinator.com/item?id=34513341
Bayesian Project Management (2015),http://www.maxwideman.com/guests/bayesian/intro.htm
Trs80gp – A TRS-80 Emulator,http://48k.ca/trs80gp.html
The six dumbest ideas in computer security (2005),http://ranum.com/security/computer_security/editorials/dumb/index.html
Show HN: I “wrote” a kid's book with ChatGPT and Midjourney,https://adventure-of-penelope.vercel.app/
The Story behind ASINs – Amazon Standard Identification Numbers (2021),https://inventlikeanowner.com/blog/the-story-behind-asins-amazon-standard-identification-numbers/
Google Search URL Request Parameters (2016),https://stenevang.wordpress.com/2013/02/22/google-advanced-power-search-url-request-parameters/
Ibn Battuta: A Scholar's Epic Journey (2018),https://www.jurnalanas.com/blog/2018-03-24-ibn-battuta-and-his-journey
Development Containers,https://containers.dev/
Evidence that Adani Group has engaged in stock manipulation and accounting fraud,https://hindenburgresearch.com/adani/
How to prioritize tasks?,https://jimmyislive.dev/posts/how-to-prioritize/
Three bugs in the Go MySQL driver (2020),https://github.blog/2020-05-20-three-bugs-in-the-go-mysql-driver/
Hackers demand $10M from Riot Games to stop leak of ‘League of Legends’ code,https://www.vice.com/en/article/qjky8d/hackers-demand-dollar10m-from-riot-games-to-stop-leak-of-league-of-legends-source-code
Things that improved between Elasticsearch 1 and 7,https://underthehood.meltwater.com/blog/2023/01/20/how-we-upgraded-an-old-3pb-large-elasticsearch-cluster-without-downtime-part-7-final-architecture-learnings/
Microsoft 365 Down,https://status.office365.com/
1min high-intensity exercise 3x a week improves fitness as much as 3x aerobics,https://pubmed.ncbi.nlm.nih.gov/27115137/
Microsoft Azure Outage,https://twitter.com/MSFT365Status/status/1618149579341369345
Macroeconomic Changes Have Made It Impossible for Me to Want to Pay You,https://www.mcsweeneys.net/articles/macroeconomic-changes-have-made-it-impossible-for-me-to-want-to-pay-you
Show HN: Refine v3.97 – Open-source React framework for building CRUD apps,https://github.com/refinedev/refine/blob/next/CHANGELOG.md
Fun with macOS's Sip,https://metalbear.co/blog/fun-with-macoss-sip/
Google’s Fuchsia OS was one of the hardest hit by last week’s layoffs,https://arstechnica.com/gadgets/2023/01/big-layoffs-at-googles-fuchsia-os-call-the-projects-future-into-question/
Azure DevOps Outage,https://status.dev.azure.com/_event/362852649
The CSS at w3.org is gone,https://www.w3.org/
"Show HN: I've built a C# IDE, Runtime, and AppStore inside Excel",https://querystorm.com/csharp-in-excel/
Mjolnir,https://fabiensanglard.net/mjolnir/index.html
1min high-intensity exercise 3x a week improves fitness as much as 3x aerobics (2016),https://pubmed.ncbi.nlm.nih.gov/27115137/
"Motors for Makers: A Guide to Steppers, Servos, and Other Electrical Machines",http://www.motorsformakers.com/
Mjolnir,https://fabiensanglard.net/mjolnir/
IPinside: Korea’s Mandatory Spyware,https://palant.info/2023/01/25/ipinside-koreas-mandatory-spyware/
LastPass breach gets worse – reddit.com/r/sysadmin,https://old.reddit.com/r/sysadmin/comments/10kp4ye/lastpass_breach_gets_worse/
EVs Are Essential Grid-Scale Storage,https://spectrum.ieee.org/electric-vehicle-grid-storage
A Matchbox Game-Learning Machine (1991) [pdf],https://gwern.net/docs/reinforcement-learning/model-free/1991-gardner-ch8amatchboxgamelearningmachine.pdf
DevRel should be a process not a project,https://podcast.bitreach.io/episodes/jason-lengstorf
First Light Fusion to Build Demonstration Facility at UKAEA’s Culham Campus,https://firstlightfusion.com/media/first-light-fusion-signs-agreement-with-uk-atomic-energy-authoritygratulates-nif-on-its-maiden-gain-result-2
"Show HN: A simple world flags game, my first web dev project as a beginner",https://billywojcicki.github.io/vexillologist/
Parallel streaming in Haskell: Part 4 – Conditionals and non-blocking evaluation,https://www.channable.com/tech/parallel-streaming-in-haskell-part-4-conditionals-and-non-blocking-evaluation
SQLite-based databases on the Postgres protocol,https://blog.chiselstrike.com/sqlite-based-databases-on-the-postgres-protocol-yes-we-can-358e61171d65
"Motors for Makers: A Guide to Steppers, Servos, and Other Electrical Machines (2015)",http://www.motorsformakers.com/
Bionic 3rd Thumb [video],https://www.youtube.com/watch?v=Ba4YklRq0Po
"Hilton Hotels Loyalty Program Data Breached, Info of 3.7M Users for Sale",https://thecyberexpress.com/hilton-hotels-loyalty-program-data-breached/
We tried to run a social media site and it was awful,https://www.ft.com/content/8d995a24-d77c-4208-a3a6-603d8788ebcd
Calling Ruby Methods in C: Avoid Memory Leaks,https://blog.appsignal.com/2023/01/25/calling-ruby-methods-in-c-avoid-memory-leaks.html
Amazon warehouse workers stage first-ever strike in the UK,https://www.cnbc.com/2023/01/25/amazon-workers-stage-first-ever-strike-in-the-uk-over-pay-working-conditions.html
How to Be 18 Years Old Again for Only $2M a Year,https://www.bloomberg.com/news/features/2023-01-25/anti-aging-techniques-taken-to-extreme-by-bryan-johnson
Using {Blocks} in Rust and Go for Fun and Profit,https://taylor.town/code-blocks
Ask HN: Anyone here working on/with Membrane Computing?,https://news.ycombinator.com/item?id=34517921
Coinbase’s chief product officer will leave with a $105M payday,https://dlnews.com/articles/coinbase-chief-product-officer-surojit-chatterjee-gets-105-million-payday
Annotated: Sam Bankman-Fried's “FTX Pre-Mortem Overview”,https://www.mollywhite.net/annotations/sbf-ftx-pre-mortem-overview
Replacing a SQL analyst with 26 recursive GPT prompts,https://www.patterns.app/blog/2023/01/18/crunchbot-sql-analyst-gpt/
"Jetnet Acquires ADS-B Exchange, a community-fed ADSB aggregator",https://www.jetnet.com/news/jetnet-acquires-ads-b-exchange.html
Antidepressants help bacteria resist antibiotics,https://www.nature.com/articles/d41586-023-00186-y
"Show HN: Automatisch – Open source workflow automation, an alternative to Zapier",https://automatisch.io
Do Not Taunt Happy Fun Branch Predictor,https://www.mattkeeter.com/blog/2023-01-25-branch/
