title,link
FCC proposes $504k fine for broadcaster's misuse of Emergency Alert System tones,https://www.insideradio.com/free/fox-sports-admits-it-used-fake-eas-tones-on-radio-as-well-as-tv/article_6b18d2f0-9e1c-11ed-ab28-c7b167cea819.html
Automerge 2.0,https://automerge.org/blog/automerge-2/
The benefits of everything being a buffer in Emacs,https://mbork.pl/2023-01-30_The_benefits_of_everything_being_a_buffer
Ask HN: Do you use JSON Schema? Help us shape its future stability guarantees,https://news.ycombinator.com/item?id=34587360
Git archive checksums may change,https://github.blog/changelog/2023-01-30-git-archive-checksums-may-change/
Burning a NeXTCube (1993),https://simson.net/ref/1993/cubefire.html
A Modern Compiler for the French Tax Code (2020),https://arxiv.org/abs/2011.07966
Firefighters forced to smash window of driverless Cruise taxi to stop it,https://www.businessinsider.com/san-francisco-firefighters-smashed-window-driverless-cruise-taxi-stop-it-2023-1
Cistercian Numerals,https://kottke.org/23/01/cistercian-numerals
When Screens Were Secondary: Mario Bellini's TCV 250 for Olivetti,https://www.core77.com/posts/117998/When-Screens-were-Secondary-Mario-Bellinis-TCV-250-for-Olivetti
Yahoo is making a return to search,https://searchengineland.com/yahoo-is-making-a-return-to-search-392341
SimulaVR FPGA Image Processing Pipeline,https://simulavr.com/blog/fpga-image-processing-pipeline/
Proving Earth is a globe,https://mctoon.net/interesting/
On “I don't trust microcode” (2021),https://patrick.georgi.family/2021/02/13/on-microcode/
Learn the basics of coding with a needle and thread (2018),https://www.ideo.com/blog/learn-the-basics-of-code-with-a-needle-and-thread
Google Play Developer Antitrust Litigation,https://www.googleplaydevelopersettlement.com
The Mathematical Center of the Universe (2021),https://www.privatdozent.co/p/the-mathematical-center-of-the-universe-28f
Need help with students who've turned my class into a dating service,https://academia.stackexchange.com/questions/192977/need-help-with-students-whove-turned-my-class-into-a-dating-service
Google Fi seemingly affected by latest T-Mobile data breach,https://9to5google.com/2023/01/30/google-fi-data-breach-tmobile/
Rewrite it in Rust,https://github.com/fish-shell/fish-shell/pull/9512
Light from an ionized state of helium in a distant galaxy,https://www.quantamagazine.org/astronomers-say-they-have-spotted-the-universes-first-stars-20230130/
Mario Bellini's TCV 250 for Olivetti,https://www.core77.com/posts/117998/When-Screens-were-Secondary-Mario-Bellinis-TCV-250-for-Olivetti
Ferroelectric Memories: The Middle Ground,https://semiengineering.com/ferroelectric-memories-the-middle-ground/
"I made a website for lonely people, and got >100 people to log their locations",https://www.lonelyworld.info/
Over the past 21 months I’ve written a code editor from the ground up,https://edita.vercel.app/blog/approach/
Understanding the x86's Decimal Adjust after Addition (DAA) instruction,http://www.righto.com/2023/01/understanding-x86s-decimal-adjust-after.html
"The limits of ""computational photography""",https://yager.io/comp/comp.html
I Added GitHub Copilot to My Toolbelt,https://spin.atomicobject.com/2023/01/30/github-copilot-toolbelt/
D.C. free bus bill becomes law as zero-fare transit systems take off,https://www.cnbc.com/2023/01/30/dc-free-bus-bill-becomes-law-zero-fare-transit.html
Hybrid Search and Learning-to-Rank,https://www.pinecone.io/learn/metarank/
Open source implementation of Google's MusicLM in PyTorch,https://github.com/lucidrains/musiclm-pytorch
I want to lose every debate,https://sive.rs/led
Marko: An HTML-Based Language,https://markojs.com
Ask HN: What's the best lecture series you've seen?,https://news.ycombinator.com/item?id=34591291
Show HN: Generate commit messages using GPT-3,https://github.com/markuswt/gpt-commit
The x86's Decimal Adjust after Addition (DAA) instruction,http://www.righto.com/2023/01/understanding-x86s-decimal-adjust-after.html
"Insulation: First the body, then the home (2011)",https://www.lowtechmagazine.com/2011/02/body-insulation-thermal-underwear.html
Towards A Token-Free Future In NLP (2022),https://peltarion.com/blog/data-science/towards-a-token-free-future-in-nlp
Ask HN: Getting back into an IC role as a manager,https://news.ycombinator.com/item?id=34590471
Why ultra-light urban vehicles offer the only viable future for EVs,https://www.maddyness.com/uk/2023/01/26/why-ultra-light-urban-vehicles-like-luvly-offer-the-only-viable-future-for-electric-cars/
Analog computing may be coming back,https://bellmar.medium.com/guess-what-analog-computing-may-be-coming-back-280f8c0329a8
Entering and Running a Tiny Program from the PDP-11 (PiDP-11) Front Panel,https://bigdanzblog.wordpress.com/2023/01/26/entering-and-running-a-tiny-program-from-the-pdp-11-pidp-11-front-panel/
Beta Testers required for my book-recommendation website,https://www.bookclub.ai/
A Midcentury Bender: Revisiting Mad Men,https://theamericanscholar.org/a-midcentury-bender/
Professor Edgerton’s Atomic Camera (2006),https://www.damninteresting.com/curio/rapatronic-nuclear-photographs/
Console Screendumps,https://research.exoticsilicon.com/articles/console_screendumps
Ask HN: What API's do people wanna buy/pay for?,https://news.ycombinator.com/item?id=34593025
The army of maths prodigies who helped Brighton conquer the transfer market,https://uk.sports.yahoo.com/news/revealed-200-maths-prodigies-help-070000511.html
"I lost $209,640 of my own money trying to start a business",https://www.mostlymetrics.com/p/i-lost-209640-of-my-own-money-trying
The Decision Book: Fifty models for strategic thinking (2019),https://medium.com/@snehal.katare/book-summary-the-decision-book-fifty-models-for-strategic-thinking-ad866b60fa40
How to smooth and spread A* paths for an RTS,https://www.construct.net/en/blogs/ashleys-blog-2/rts-devlog-extreme-pathfinding-1608
Electro Gyrocator,https://en.wikipedia.org/wiki/Electro_Gyrocator
UK expected to be only major economy to shrink in 2023 – IMF,https://www.bbc.co.uk/news/business-64452995
Nim and Go programs identified as malware on Windows,https://forum.nim-lang.org/t/9850
Japanese explained to programmers,https://lajili.com/posts/post-1/
Backblaze Drive Stats for 2022,https://www.backblaze.com/blog/backblaze-drive-stats-for-2022/
"Typed Lisp, a primer (2019)",http://alhassy.com/TypedLisp
The 2012 Millennium Artifact,https://www.cs.rochester.edu/users/faculty/nelson/courses/csc_200/project_2012_site/index.html
Show HN: Working on a Zero-Knowledge Daily Journaling App,https://jumblejournal.org/
W3C re-launched as a public-interest non-profit organization,https://www.w3.org/blog/news/archives/9823
Superconductivity switches on and off in 'magic-angle' graphene,https://phys.org/news/2023-01-superconductivity-magic-angle-graphene.html
DIY triple-screen laptop based on the framework,https://www.youtube.com/watch?v=aUKpY0o5tMo
Spotify is first music streaming service to surpass 200M paid subscribers,https://www.theverge.com/2023/1/31/23577499/spotify-q4-2022-earnings-release-subscriber-growth-layoffs
The (first) post-Elizabethan age,https://www.prospectmagazine.co.uk/arts-and-books/blazing-world-post-elizabethan-age
CA Cities to Lose All Zoning Powers in 2 Days,https://darrellowens.substack.com/p/ca-cities-to-lose-all-zoning-powers
India’s population will start to shrink sooner than expected,https://www.economist.com/asia/2021/12/02/indias-population-will-start-to-shrink-sooner-than-expected
"In roughly two hours, 1647 devices are about to be wiped",https://infosec.exchange/@SecurityWriter/109777576538835360
Launch HN: Needl (YC S22) – Simple search across all your apps,https://news.ycombinator.com/item?id=34598406
WebAssembly: Adding Python Support to WASM Language Runtimes,https://wasmlabs.dev/articles/python-wasm32-wasi/
"QuestDB, Open-Source Database, Is Hiring a DevRel Engineer (US-Based)",https://questdb.io/careers/developer-relations-engineer/
Tesla tells investors it’s being investigated by the Justice Department,https://arstechnica.com/cars/2023/01/tesla-confirms-justice-department-investigation-into-autopilot/
Show HN: Silly Math Games to Make Learning Fun for K through 3rd Grade,https://www.mindlygames.com
A New Lower Bound in the Abc Conjecture,https://arxiv.org/abs/2301.11056
New mathematical model shows how the body regulates potassium,https://phys.org/news/2023-01-mathematical-body-potassium.html
A judge ordered the unsealing of Sam Bankman-Fried's 2 anonymous bail sponsors,https://www.businessinsider.com/sam-bankman-fried-bail-sponsors-should-be-public-judge-says-2023-1
Gödel's Solution to Einstein's Field Equations (1949),https://www.privatdozent.co/p/godels-solution-to-einsteins-field
Weaponizing hyperfocus: Becoming the first DevRel at Tailscale,https://tailscale.dev/blog/weaponizing-hyperfocus
Cosmic DE update: System76's new Linux desktop environment,https://blog.system76.com/post/more-on-cosmic-de-to-kick-off-2023/
New AI classifier for indicating AI-written text,https://openai.com/blog/new-ai-classifier-for-indicating-ai-written-text/
Sourcehut will not blacklist the Go module mirror,https://sourcehut.org/blog/2023-01-09-gomodulemirror/
Hermes: An open-source document management system,https://www.hashicorp.com/blog/introducing-hermes-an-open-source-document-management-system
Critical brain hypothesis: A physical theory for when the brain performs best,https://www.quantamagazine.org/a-physical-theory-for-when-the-brain-performs-best-20230131/
Craftwork is hiring our first Computer Vision Engineer,https://angel.co/l/2yfPn3
ASRock Industrial NUCS Box-1360P/D4 Review: Raptor Lake-P Plus Surprise ECC,https://www.anandtech.com/show/18732/asrock-industrial-nucs-box1360pd4-review-raptor-lakep-ecc
Tell HN: Heroku deleted my database with no warning,https://news.ycombinator.com/item?id=34598563
WebAssembly: Adding Python support to WASM language runtimes,https://wasmlabs.dev/articles/python-wasm32-wasi/
Discovery could extend battery life by replacing tape that causes self‑discharge,https://www.dal.ca/news/2023/01/16/dalhousie-battery-discovery-self-discharge.html
Builder's Remedy goes into effect in many California cities tomorrow,https://darrellowens.substack.com/p/ca-cities-to-lose-all-zoning-powers
Tell HN: GitHub will delete your private repo if you lose access to the original,https://news.ycombinator.com/item?id=34600985
DetectGPT: Zero-Shot Machine-Generated Text Detection,https://arxiv.org/abs/2301.11305
Extracting training data from diffusion models,https://arxiv.org/abs/2301.13188
Generating Platonic Solids in C++ (2021),https://www.danielsieger.com/blog/2021/01/03/generating-platonic-solids.html
Is AM radio dead?,https://www.jeffgeerling.com/blog/2023/am-radio-dead
"IEEE Medal of Honor Goes to Vint Cerf, Co-Author of TCP/IP",https://spectrum.ieee.org/2023-ieee-medal-of-honor
Show HN: Silly math games to make learning fun for K through 3rd grade,https://www.mindlygames.com
Gödel's solution to Einstein's field equations (2021),https://www.privatdozent.co/p/godels-solution-to-einsteins-field
"“In roughly two hours, 1647 devices are about to be wiped”",https://infosec.exchange/@SecurityWriter/109777576538835360
A New Lower Bound in the ABC Conjecture,https://arxiv.org/abs/2301.11056
Electro Gyro-Cator,https://en.wikipedia.org/wiki/Electro_Gyrocator
Ask HN: How do you test SQL?,https://news.ycombinator.com/item?id=34602318
"Instagram’s co-founders are back with Artifact, a kind of TikTok for text",https://www.theverge.com/2023/1/31/23579552/artifact-instagram-cofounders-kevin-systrom-mike-krieger-news-app
Modernizing C arrays for greater memory safety: a case study in the Linux kernel,https://people.kernel.org/kees/bounded-flexible-arrays-in-c
Concordia Students Set to Launch Most Powerful Rocket Developed by Civilians,https://www.concordia.ca/news/stories/2023/01/23/members-of-space-concordia-have-their-hearts-set-on-the-stars.html
Why Finland Selected the F-35A (2021),https://corporalfrisk.com/2021/12/11/f-35a-is-hx-the-winner-takes-it-all/
Snap Quarterly Results Q4 2022 [pdf],https://investor.snap.com/files/doc_financials/2022/q4/Q4%2722-Earnings-Slides.pdf
Bitrex – the brand name of the bitterest substance in the world,https://www.bitrex.com/
Reducing Go execution tracer overhead with frame pointer unwinding,https://blog.felixge.de/reducing-gos-execution-tracer-overhead-with-frame-pointer-unwinding/
"QuestDB (YC S20), open-source database, is hiring a devrel engineer (US-based)",https://questdb.io/careers/developer-relations-engineer/
A fairy-like robot flies by the power of wind and light,https://techxplore.com/news/2023-01-fairy-like-robot-flies-power.html
Combobulate: Structured Movement and Editing with Tree-Sitter,https://www.masteringemacs.org/article/combobulate-structured-movement-editing-treesitter
Write simply (2021),http://www.paulgraham.com/simply.html
GraphGPT: Extrapolating knowledge graphs from unstructured text,https://github.com/varunshenoy/GraphGPT
Prime Voice AI: The most realistic and versatile AI speech software,https://beta.elevenlabs.io/
Intel Cuts Employee Pay to Maintain Quarterly Dividend,https://www.semianalysis.com/p/intel-cuts-pay-for-employees-to-keep
"Contiki – OS for networked, memory-constrained systems",https://en.wikipedia.org/wiki/Contiki
Show HN: DocAsker – Use LLMs to ask documentation questions,https://www.docasker.com/
Show HN: KnifeGeek – Online Database of Pocket Knives,https://www.knifegeek.io/
C++ Neural Network in a Weekend (2020),https://www.jeremyong.com/cpp/machine-learning/2020/10/23/cpp-neural-network-in-a-weekend/
"Fast, Optimal, Any-Angle Pathfinding (Polyanya)",https://research.monash.edu/en/publications/compromise-free-pathfinding-on-a-navigation-mesh
Tablevibe (YC S21) hiring AU sales exec to help restaurants go direct-to-consumer,https://www.ycombinator.com/companies/tablevibe-co/jobs/aN5DPci-senior-sales-executive-australia-new-zealand
"Show HN: TunnlTo – Windows WireGuard split tunnel client built with Rust, Tauri",https://github.com/TunnlTo/desktop-app
Concordia students set to launch most powerful rocket developed by civilians,https://www.concordia.ca/news/stories/2023/01/23/members-of-space-concordia-have-their-hearts-set-on-the-stars.html
Is remote work bad for the economy?,https://www.fractional.work/p/is-remote-work-bad-for-the-economy
I've had bad luck with transparent hugepages on my Linux machines,https://utcc.utoronto.ca/~cks/space/blog/linux/TransparentHugepagesBadLuck
Missing radioactive capsule found in WA outback after frantic search,https://www.abc.net.au/news/2023-02-01/australian-radioactive-capsule-found-in-wa-outback-rio-tinto/101917828
Prime Voice AI: AI speech software,https://beta.elevenlabs.io/
GPTMinus1 – Fool OpenAIs AI Detector by Randomly Replacing Words,https://gptminus1.vercel.app/
Alleged serial liar George Santos had backing from FTX executives,https://www.sfgate.com/politics/article/george-santos-ftx-executives-donations-17746642.php
Do We Live in a Society Without a Counterculture?,https://www.xmodtwo.com/p/do-we-live-in-a-society-without-a
Sam Bankman-Fried accused of possible witness tampering [pdf],https://storage.courtlistener.com/recap/gov.uscourts.nysd.590940/gov.uscourts.nysd.590940.50.0.pdf
"Forthcoming OpenSSL Releases 3.0.8, 1.1.1T and 1.0.2zg",https://mta.openssl.org/pipermail/openssl-announce/2023-January/000248.html
Tiny radioactive capsule lost in Australian outback found,https://www.theguardian.com/australia-news/2023/feb/01/tiny-radioactive-capsule-lost-in-australian-outback-found-by-side-of-1400km-stretch-of-road
San Francisco is getting cold feet about self-driving car tests,https://www.newscientist.com/article/2356888-san-francisco-is-getting-cold-feet-about-self-driving-car-tests/
A URL shortener not shortening the URL but makes it look very dodgy,https://github.com/defaultnamehere/verylegit.link
Morning exposure to deep red light improves declining eyesight,https://www.nature.com/articles/s41598-021-02311-1
BioGPT: A Language Model Pre-Trained on Large-Scale Biomedical Literature,https://www.marktechpost.com/2023/01/31/microsoft-research-proposes-biogpt-a-domain-specific-generative-transformer-language-model-pre-trained-on-large-scale-biomedical-literature/
Astonishing regularity in learning rate among college students,https://psyarxiv.com/pxsfh/
Why Are Online Recipes Always So Long-Winded?,https://jjpryor.substack.com/p/why-are-online-recipes-always-so
The Curse of the Corporate Headshot,https://www.economist.com/business/2023/01/26/the-curse-of-the-corporate-headshot
We are ‘greening’ ourselves to extinction,https://www.aljazeera.com/opinions/2023/1/29/greening-ourselves-to-extinction
How we plan to de-extinct the Dodo bird,https://colossal.com/dodo/
Stable Diffusion found to emit some images from training at generation time,https://twitter.com/Eric_Wallace_/status/1620449934863642624
"Tech only has one strategy: Embrace, Extend, Extinguish",https://mrsteinberg.com/embrace-extend-extinguish/
Stripe increases fees for EU and UK-based businesses in April,https://support.stripe.com/questions/april-2023-pricing-updates-for-businesses-based-in-europe
Operation Luigi: How I hacked my friend without her noticing,https://mango.pdf.zone/operation-luigi-how-i-hacked-my-friend-without-her-noticing
LLM discourse needs more nuance,https://proofinprogress.com/posts/2023-02-01/the-ai-crowd-is-mad.html
The Difference Between Speaking and Thinking and Why ChatGPT Is Uncanny,https://www.theatlantic.com/technology/archive/2023/01/chatgpt-ai-language-human-computer-grammar-logic/672902/
Ask HN: Who is hiring? (February 2023),https://news.ycombinator.com/item?id=34612353
Show HN: We built a developer-first open-source Zapier alternative,https://trigger.dev
A Cold War mystery: Why did Jimmy Carter save the space shuttle?,https://arstechnica.com/science/2016/07/a-cold-war-mystery-why-did-jimmy-carter-save-the-space-shuttle/
Virtual DOM is pure overhead,https://svelte.dev/blog/virtual-dom-is-pure-overhead
Data Visualization: Choropleth maps with ggplot and R,https://socviz.co/maps.html
Operation Luigi: How I hacked my friend without her noticing (2017),https://mango.pdf.zone/operation-luigi-how-i-hacked-my-friend-without-her-noticing
Do we live in a society without a counterculture?,https://www.xmodtwo.com/p/do-we-live-in-a-society-without-a
"YC is hiring a product engineer to work on co-founder matching (SF/remote, US)",https://news.ycombinator.com/item?id=34613508
Interop 2023: continuing to improve the web for developers,https://web.dev/interop-2023/
Data-free Disney: Evading data capture at Disneyland,https://www.optoutproject.net/data-free-disney/
Tuning into brainwave rhythms speeds up learning in adults,https://www.cam.ac.uk/stories/brainwavelearning
Netlify acquires Gatsby,https://www.netlify.com/press/netlify-acquires-gatsby-inc-to-accelerate-adoption-of-composable-web-architectures/
"Academia’s culture of overwork almost broke me, so I’m working to undo it",https://www.nature.com/articles/d41586-023-00241-8
"Automatic, AI-generated interview notes by Metaview",https://www.metaview.ai/notes
Discovering unique microbes made easy with new software platform,https://phys.org/news/2023-01-unique-microbes-easy-software-platform.html
Tech Nation shutting down as UK government pulls key funding,https://sifted.eu/articles/tech-nation-shutting-down/
Never take meeting notes again,https://www.meetjamie.ai/
Ask HN: Who wants to be hired? (February 2023),https://news.ycombinator.com/item?id=34612351
Regularity in student learning rate,https://psyarxiv.com/pxsfh/
"When Discord is open in the background, NVIDIA card will not reach full speed",https://nvidia.custhelp.com/app/answers/detail/a_id/5443/~/when-discord-is-open-in-the-background%2C-graphics-card-memory-clocks-will-not
Ask HN: Freelancer? Seeking freelancer? (February 2023),https://news.ycombinator.com/item?id=34612352
Show HN: Sudoku with 0 Bells or Whistles,https://news.ycombinator.com/item?id=34611732
Why are online recipes so long-winded?,https://jjpryor.substack.com/p/why-are-online-recipes-always-so
"Little Languages for Music (CLI as DAW, 1990) [pdf]",https://www.usenix.org/legacy/publications/compsystems/1990/spr_langston.pdf
The Rock 5B is not a Raspberry Pi killer–yet,https://www.jeffgeerling.com/blog/2023/rock-5-b-not-raspberry-pi-killer-yet
The Golden Age of Glossies,https://www.nybooks.com/online/2023/01/30/the-golden-age-of-glossies/
Destroy All Monsters (2006),https://www.thebeliever.net/destroy-all-monsters/
ChatGPT Plus,https://openai.com/blog/chatgpt-plus/
Release engineering is exhausting so here's cargo-dist,https://blog.axo.dev/2023/02/cargo-dist
Python's “disappointing” superpowers,https://lukeplant.me.uk/blog/posts/pythons-disappointing-superpowers/
Same.energy: Image Search by Similarity,https://same.energy
The Cost of Shadow Work,https://www.ft.com/content/c2913c55-b9f5-44fa-b6dc-7cd7a2659925
Data-Free Disneyland,https://www.optoutproject.net/data-free-disney/
Go 1.20 released,https://go.dev/doc/go1.20
Choropleth maps with ggplot and R,https://socviz.co/maps.html
Virtual DOM is pure overhead (2018),https://svelte.dev/blog/virtual-dom-is-pure-overhead
GNU Radio in a Direct-RF World [video],https://archive.org/details/youtube-7N27o-DpQZM
"Hitchmap: Like Yelp, but for Hitchhiking Spots",https://hitchmap.com
The curse of the corporate headshot,https://www.economist.com/business/2023/01/26/the-curse-of-the-corporate-headshot
Did Ancient Egypt have a pigeon problem?,https://www.atlasobscura.com/articles/ancient-egypt-pigeon-problem
Richard Bartle explains Web3's flaws at a Web3 conference. It doesn't go well,https://nwn.blogs.com/nwn/2023/02/richard-bartle-crypto-circle-blockchain-nft-virtual-worlds.html
"Information Theory, Inference, and Learning Algorithms (2003)",https://inference.org.uk/itila/book.html
Infinite partial sumsets in the primes – Terence Tao,https://terrytao.wordpress.com/2023/01/26/infinite-partial-sumsets-in-the-primes/
Glen Canyon Revealed,https://www.hcn.org/issues/55.2/features-water-glen-canyon-revealed
Meta Reports Fourth Quarter and Full Year 2022 Results,https://investor.fb.com/investor-news/press-release-details/2023/Meta-Reports-Fourth-Quarter-and-Full-Year-2022-Results/default.aspx
"Show HN: PromptLayer – Track, debug, and maintain GPT prompts in prod",https://promptlayer.com/?hn
We need less powerful languages (2015),https://lukeplant.me.uk/blog/posts/less-powerful-languages/
Float Compression 3: Filters,https://aras-p.info/blog/2023/02/01/Float-Compression-3-Filters/
Top-Left Magic Corner Desktop Paradigm,https://rentry.co/kvwze
Hypermedia Clients,https://htmx.org/essays/hypermedia-clients/
An elephant survived a 10M jump from Wuppertal's suspension railway in 1950,https://www.outdooractive.com/en/story/bergisches-land/the-elephant-that-jumped-out-of-a-suspension-railway-/26795022/
ChatGPT is a bullshit generator but it can still be amazingly useful,https://aisnakeoil.substack.com/p/chatgpt-is-a-bullshit-generator-but
What the ancient bog bodies knew,https://www.nytimes.com/2023/01/30/science/archaeology-bogs-mummies.html
"Google layoffs Jan 20, 2023 – California WARN public records",https://airtable.cool/shrF23JdDHMQ3QDyw
Flame: A small language model for spreadsheet formulas,https://arxiv.org/abs/2301.13779
The radical moral implications of luck in human life (2020),https://www.vox.com/science-and-health/2018/8/21/17687402/kylie-jenner-luck-human-life-moral-privilege
Infinite partial sumsets in the primes,https://terrytao.wordpress.com/2023/01/26/infinite-partial-sumsets-in-the-primes/
Microsoft Teams Premium: powered by OpenAI’s GPT-3.5,https://www.microsoft.com/en-us/microsoft-365/blog/2023/02/01/microsoft-teams-premium-cut-costs-and-add-ai-powered-productivity/
Some insects I found inside dried Turkish figs from Trader Joe’s,https://colinpurrington.com/2023/01/some-insects-i-found-inside-dried-turkish-figs-from-trader-joes/
AI Generated Seinfeld runs 24/7 on Twitch,https://www.twitch.tv/watchmeforever
S.F. apartment rents fell again,https://www.sfchronicle.com/sf/article/s-f-apartment-rents-fell-again-tech-layoffs-17757376.php
Show HN: AI Cover Letter Writer,https://tally.work/
History of Lisp Parentheses (2019),https://github.com/shaunlebron/history-of-lisp-parens
Bethesda’s Redfall needs to be online for single-player mode,https://arstechnica.com/gaming/2023/02/single-player-redfall-still-requires-a-persistent-online-connection/
Project Enable – The Diné-English Biology Dictionary,https://enablenavajo.org/dine/
Anki and GPT-3,https://andrewjudson.com/spaced-repetition/2023/02/01/anki-chrome.html
"For police PR flacks, quack lives matter",https://radleybalko.substack.com/p/for-police-pr-flaks-quack-lives-matter
Calmira Reborn – a Windows 9x-inspired shell for Windows 3.1,http://huntertur.net/calmirar.html
Electrical stimulation can boost brain's willingness to engage in mental effort,https://www.psypost.org/2023/01/buzzing-the-brain-with-electricity-can-boost-the-willingness-to-engage-in-mental-effort-67245
Erlang: The coding language that finance forgot,https://www.efinancialcareers.com/news/2022/01/elixir-jobs
How to find a tiny radioactive source while doing 70 kph,https://www.ansto.gov.au/news/wa-outback-proves-no-match-for-aussie-nuclear-know-how
Ask HN: Who needs beta testers? (February 2023),https://news.ycombinator.com/item?id=34622877
Why I’m making my family German (2017),https://www.theguardian.com/lifeandstyle/2017/jun/03/why-im-making-my-family-german
Ask HN: How do you plan on making money with Open AI API?,https://news.ycombinator.com/item?id=34622355
Stop Developing This Technology,https://github.com/iperov/DeepFaceLive/issues/41
OpenQNX Source (2007),https://github.com/vocho/openqnx/blob/master/trunk/lib/c/1/open.c
